id;tweet;stance;;;
1423530540536320000;Il green pass non è sanitario, ma politico, distingue i servi del regime dai dissidenti;contro;;;
1423903517534720000;"Ho notato che siamo già passati al livello successivo.
 Il green pass orale.
 

 ""Ma ce l'hai il Green pass? Vai vai""";neutro;;;
1423208007379431424;"Tra un po' diranno che siccome il green pass è scomodo, perché non passare direttamente al microchip? 
 E così i complottari le avranno prese tutte! 😄😄😄😄
 #greenpass #greenpassobbligatorio #NoGreenPass";contro;;;
1423208098861301760;Ragazze non so se lo sapete ma vi servirà il green pass per assistere ai concerti, quindi vi conviene vaccinarvi se non volete pagare 80 euro di tampone. Mi raccomando. Vaccinarsi è importante #amemici20;pro;;;
1423209063517671424;"COVIT, GREEN PASS, E I LORO SERVI I MEDIA ITALIANI.
 E UN PRECEDENTE PERICOLOSO, NON NASCONDIAMOCI DIETRO LO STIPENDIO SICURO DA MANTENERE AD OGNI COSTO E PUBBLICARE LA VOCE DEL PADRONE SE DICE IL VERO O IL FALSO, LA STORIA E PIENA DI MENSOGNE DA PARTE DEI POTENTI PER IL POTERE";contro;;;
1423209395144495105;Paragonare il green pass al chiedere lo status HIV è disgustoso e illogico 🤡;pro;;;
1423209442531758081;"Abbiamo oggi una ""sinistra"" contro le piazze, filogovernativa, che adotta gli slogan del potere e delle multinazionali.
 Urlano vaccini per tutti, indossano le mascherine degli Elkann, inneggiano al green pass. Psichiatrizzano il dissenso, deridono la protesta: si credono colti.";neutro;;;
1423209481886912515;Da domani il tuitter sarà invaso dai piagnistei per l’entrata in vigore del Green Pass immagino…;neutro;;;
1423209540955291649;Mia sorella che “andiamo a mangiare cinese” ma non si è più sentita, e a me arriva il green pass tra due settimane 🥲;neutro;;;
1423209838914555910;Se tutto l'impegno che viene messo per boicottare i ristoranti che non utilizzeranno il green pass venisse messo per boicottare i ristoranti che sfruttano i lavoratori, forse oggi saremmo uno Stato migliore.;neutro;;;
1423210103554072576;"vorrei conoscere la percentuale di download dell'app per capire se il green pass è vero o falso.
 vediamo se superano immuni LOL";neutro;;;
1423210169157181440;"Sulle app di dating, nei profili, stanno comparendo ""vaccinato/n. dosi"", ""con green pass""... difficile, diventa sempre più difficile.";neutro;;;
1423210415656476673;"In autunno sarà boom di contagi nonostante il green pass.
 

 E allora per chi ha propagandato e votato questa misura liberticida e inutile, che porterà al fallimento tantissime PMI, dovrebbe esserci la galera!
 

 #NoGreenPass";contro;;;
1423210605289345025;"sto leggendo il saggio pubblicato dall'Osservatorio per la Legalità Costituzionale di Magistratura Democratica dal titolo "" Sul Dovere costituzionale e comunitario di Disapplicazione del decreto Green Pass """;neutro;;;
1423210723035996161;#novax Vorrei capire. Se ad un novax viene un cancro e gli propongono una nuova cura, diciamo sperimentale, non la fa? Non si fida perché nuova? Chiede se gli iniettano grafene?;pro;;;
1423210902090878976;"Ho letto il tweet di un novax che sostiene che il problema del green pass per lui non esiste, visto che al bar non si siede mai, e non va in un museo dalle elementari...

Direi che non c'è niente da aggiungere.";pro;;;
1423210964468604931;"Noto che spesso i ristoratori indossano la mascherina sotto al naso, sul mento o non la indossano proprio.
 Loro sono quelli che dovrebbero chiedere il Green pass?";neutro;;;
1423211288948260866;Sono andato a prendermi il green pass in farmacia e ho appena letto che vale per soli 9 mesi, cioè fra 9 mesi dovrò rifare un'altra dose o tutte e 2?;neutro;;;
1423211384892952576;90 centesimi per stampare il green pass a colori mi sembra un quasi furto.;neutro;;;
1423211546386305025;praticamente io da domani non posso fare più nulla perché ho la seconda dose il 9 e il green pass chissà quando m'arriva, bene dai;neutro;;;
1423211601675628544;"MA CAZZEROLA SIETE DI LEGNO?
 MA CHE CREDETE CHE IL GREEN PASS SERVI A QUALCOSA SE NON AL RICATTO PER FARSI AVVELENARE DALLA MERDA DETTA VACCINO SENZA ASSUMERSI LA RESPONSABILITÀ DELLE CAUSE AVVERSE CHE MANCO LE CASE FARMACEUTICHE SI VOGLIONO ASSUMERE ? BASTARDIIIIIIII🤘🤘🤘🤘🤘🤘";contro;;;
1423211892621860868;"""Da vaccinato ho preso la Delta e sono stato male ma se mi faccio delle domande mi danno del novax"" no, ti danno del novax perché vuoi insinuare che il vaccino non serve a niente quando nessuno ha mai detto che protegge dal virus al 100%.
Non capiscono un cazzo e parlano.";pro;;;
1423211989258670080;Ma che davero mi metto a discutere con un novax costituzionalista? SVEGLIAAA MICIOOO!!!;pro;;;
1423212815351963652;Si inventano finti ricoverati NoVax che grazie al vaccino guariscono per indurre la popolazione a vaccinarsi. Che schifo!;contro;;;
1423213151278018561;😂😂😂😂😂 OGGI IL GREEN PASS ... IL BELLO È CHE VOI TUTTI CREDETTE CHE SARA FATTO DA ESPERTI NEL SETTORE MEDICINA 😂😂😂😂 SBAGLIATO È FATTO DA 5 PERSONE SOLO 5 E DI MEDICINA NE SANNO QUANTO ME 😂😂😂😂 È DRAGHI SE STA HA FA ABBINDOLA DAI 5 SIAMO IN MERDA X COLPA DI CIALTRONI;contro;;;
1423213564496654336;mi ci voleva covid e green pass per riuscire a visitare il museo egizio di torino;neutro;;;
1423213671342346243;"Il PD e Speranza vogliono il green pass per ogni attività e il prima possibile. Forza Italia vuole l'obbligo vaccinale per tutti, la lega vuole rinviare la discussione a settembre. Ditemi ora, in questo panorama politico, chi dovrei votare ...🙄
 #5agosto";neutro;;;
1423213855350706178;Siete dei venduti voi della stampa ...anche voi a spingere sulla menzogna e spingere il green pass ...VERGOGNATEVI... #lariachetirala7;contro;;;
1423214070606483457;#lariachetirala7' vorrei chiederle a quel tracotante di Borgonovo che male c'è ad usare il green pass per spingere alla vaccinazione. È un sistema come un altro per favorire una campagna vaccinale che è necessaria. Come ne dobbiamo uscire?;pro;;;
1423214652318699522;"domani inizia la fase green pass, io ho appena fatto due vaccini e devo aspettare per quello covid
 

 ok che non esco mai, ma se mi capitasse di uscire non potrei fare un cazzo";neutro;;;
1423215057027145730;Domani entra in vigore il Green pass?;neutro;;;
1423215211696345090;"Cari esercenti di  BAR, RISTORANTI, ECCCCCCCCCCC  .....
  RIBELLATEVI PERCHÉ AVRETE  POCHI CLIENTI E CHIUDERETE !!!!!!  NO GREEN PASS!";contro;;;
1423215223469756417;Alle persone per bene e rispettose non frega niente di tutti quei ristoratori, albergatori singoli cittadini che non vogliono il Green Pass e non vogliono vaccinarsi e mettono a rischio la salute pubblica.;pro;;;
1423215490726514689;Non vedo l’ora di sfoggiare il mio green pass anche in Italia;pro;;;
1423215763633094657;"Green Pass, Crisanti: “Nessuna prova che modifichi la trasmissione del virus, è solo strumento per convincere le persone a vaccinarsi”
 

 Di redazione";neutro;;;
1423215876489232388;Dov'è il mio Green Pass QUALCUNO MI DIA IL MIO GREEN PASS AAAAAAH #VaxxedAndMasked #greenpass;pro;;;
1423215897465040896;"Help me:
 il motivo per cui una persona che ha fatto il COVID e come prova non ha un tampone ma un test Anticorpale anti-RBD con IGg a valore massimi dopo 9 mesi (&gt;2080 Bau/ml) non può avere un green pass in attesa di vaccinarsi quando le IGG scenderanno?
 Cc @539th @carbo_marco79";neutro;;;
1423216316790579202;"Ma che cosa sta' blaterando sto' DRAGHI ? 
 Per andare a comprare il pane al supermercato dovrei esibire un green pass ?????
 manco in tempo di guerra ......";contro;;;
1423216412336738304;Dopo quanto tempo dalla seconda dose vi è arrivato il green pass?;neutro;;;
1423216768823308290;Diciamocelo chiaro: una delle priorità per settembre è il ritorno dei ragazzi a scuola in presenza, mandando in soffitta la didattica a distanza. Il governo propone il green pass per docenti, personale ATA e amministrativo? Mi sembra un ragionevole compromesso.;pro;;;
1423217705637793793;In arrivo #novavax il vaccino per i #novax;neutro;;;
1423217962236977153;"per avere il green pass:
 chiamo al mio medico e mi dice che devo andare in ospedale
 vado in ospedale e mi dicono che devo chiedere al mio medico
 nessuno sapeva fare niente, per fortuna poi la farmacia mi ha salvata";neutro;;;
1423218446658117632;ma dopo quanto tempo arriva il green pass? perché oggi ho la seconda dose, quando dovrebbe arrivarmi?;neutro;;;
1423218612354093058;"Il cittadino che si oppone al vaccino e green pass è un violento?
 Lo stato che lo impone invece no?";contro;;;
1423219434773172224;Ma quelli contro il green pass da chi sono rappresentati in parlamento?;neutro;;;
1423219607784067073;comunque sto green pass è una restrizione della libertà che tutti dovremmo avere di andare nei negozi, nei cinema ecc, change my mind;contro;;;
1423219848121929738;ah ma quindi il Green Pass serve anche per i concerti;neutro;;;
1423219897966940161;Non la parrucchiera novax diocane ma perché;pro;;;
1423220538063863813;Sono d’accordo che gli esercenti non possono fare i poliziotti ma come minimo dovrebbero stare dalla parte del green pass poiché se si torna “gialli o rossi “ dovranno chiudere e le conseguenze peggiori saranno x loro ( meglio prevenire che … );pro;;;
1423220686156349441;"Vi farei leggere i commenti sotto i post in cui la biblioteca dove lavoro comunica l'obbligatorietà del green pass da domani per gli utenti e i lavoratori esterni.
 Una vergogna infinita, mi imbarazzo per loro.";pro;;;
1423220745384173568;Sinceramente quando fanno le manifestazione per il “no green pass” mi incazzo, se non vi vaccinate restate a casa senza far nulla #amemici20;pro;;;
1423221009168093187;ah ma da domani ci vuole il green pass obbligatorio, voi avete già fatto la prima/seconda dose di vaccino?;neutro;;;
1423221744408662021;Ennesimo giorno in cui non riesco a ottenere il Green Pass;neutro;;;
1423222298698453001;Ma che cazzo stanno dicendo questi filosofi da 4 soldi? Paragonare l’Italia di oggi, con un governo al quale partecipano quasi tutte le forze politiche presenti in parlamento, alla Repubblica di Weimar è come paragonare il green pass alla stella degli ebrei #ZonaBianca;pro;;;
1423222394093776896;Qualcuno della REGIONE LAZIO che ha fatto il vaccino DAL PRIMO AGOSTO ha poi ricevuto il green pass? Fate girare se potete merciiiiii;neutro;;;
1423223176897695746;"BUONGIORNO ☕
 BOICOTTARE
 TUTTE LE ATTIVITÀ
 CHE RICHIEDONO
 IL GREEN PASS
 É UN DOVERE
 COSTITUZIONALE!!!
 DEVONO FALLIRE!!!";contro;;;
1423223219838914561;Gli esercenti non possono chiedere il green pass tantomeno controllori di treni e traghetti. Anche le forze dell'ordine saranno titubanti a doverlo chiedere perché possono partire denunce;neutro;;;
1423224279106269184;"GREEN PASS ILLEGITTIMO? ALLA VIGILIA SI SVEGLIANO I MEDIA MAINSTREAM
 

 Alla vigilia del vergognoso, antisociale e discriminante Green Pass, si svegliano i giornaloni. “Il Fatto quotidiano” e “Il Giornale” poche ore prima dell’instaurazione della norma antirazziale.";contro;;;
1423224318331400195;La sempre ottima @vitalbaa segnala che non si stanno mettendo limiti nè temporali nè di scopo a questo green pass. Quindi potrebbe essere che so, richiesto per il voto di ottobre, per esempio.;neutro;;;
1423224421414801409;"Che poi, va bene il green pass, io tra Francia e Italia ho speso 40€ di tamponi, MA NON LO CONTROLLA MAI UN CAZZO DI NESSUNO.
 Se non c'è controllo è INUTILE
 I N U T I L E";neutro;;;
1423224623752220675;ma per prendere i treni di lunga percorrenza per uscire dalla propria regione serve il green pass? perché ho appena letto che sarà obbligatorio solo dal 1 settembre solo che mi sembra strano ??;neutro;;;
1423224867172896768;Non ascoltate la lega e fate partire SUBITO IL GREEN PASS,RICORDATE CHE AVETE SULLA COSCIENZA LA MORTE DI PERSONE;pro;;;
1423224927176609795;Green pass per i trasporti e la scuola, il Cdm decide giovedì: l'obbligatorietà potrebbe entrare in vigore a fine agosto. Ma questo dimostra a Green pass di avere rispetto su tutto.;neutro;;;
1423224975046086656;"#COVID19 : oggi per la professoressa Viola il green pass al lavoro è obbligo vaccinale. Già dimenticato che durante la prima ondata a tutti gli imprenditori che ""costringevano"" gli addetti a lavorare veniva dato degli assassini per il non rispetto delle norme di prevenzione?";contro;;;
1423225455294009345;"Più vedo chi è contrario ai vaccini e al Green Pass e più mi sento dalla parte della ragione
 #COVID19";pro;;;
1423225610684571654;eccoci live con il green pass;neutro;;;
1423226014306639872;"Erano belli quei tempi in cui si parlava solo di FREGNA!!
#novax #NoGreenPass";contro;;;
1423226078512955393;Ma se voi siete guariti e avete fatto quindi una sola dose, il green pass ve lo hanno mandato subito?;neutro;;;
1423226263213420545;i licenziati dopo il blocco, che cazzo se ne fanno del green pass???;neutro;;;
1423226295882768387;"Dice: mi conosci bene non sono NoVax e ho già fatto il vaccino perché è giusto così. Ma ogni tanto penso; e se fosse vero che ci iniettano qualcosa tipo un programma per controllarci? Che dici?

Dico che partono malissimo se dopo 42 giorni devono farci già l’aggiornamento.";neutro;;;
1423226383757611012;Il dibattito sui novax è calato dall’alto: a dicembre 2020 esponenti del governo già deliravano sull’obbligo di vaccini che manco avevano a disposizione, al tempo. Funzionale solo alla colpevolizzazione del prossimo e allo scontro sociale, come da un anno e mezzo a questa parte;contro;;;
1423226520324165633;"Comunque non spargiamo voci 
 ma qui c'è gente che non sá come 
 funziona il Green Pass e magari 
 si prepara ad usarlo per un viaggio .
 Ma va' vá";neutro;;;
1423226711274102786;Dopo i banchi con le rotelle, l'app IMMUNI, le Primule, i plexiglas sui tavoli dei ristoranti, i plexiglas tra un'ombrellone e l'altro in spiaggia qualcuno voleva mettere anche i plexiglas sulle auto private, da domani avremo il GREEN PASS pazienza passerà pure questa...;contro;;;
1423226805859782657;Chiedo per capire: ma per un ristoratore, ad esempio, non è meglio il #Green pass del #lockdown? A Me pare che le cose siano alternative a questo punto.;pro;;;
1423226814932082689;Ma poi, c'è un lettore per questi Green pass? Sennò mostrare un codice QR qualunque è un attimo;neutro;;;
1423227309717434368;"rendetevi conto, state ingoiando tonnellate di merda da 18 mesi, sdoganando le peggiori porcate...
 come giustamente faceva notare cacciari se il green pass fosse uno strumento sanitario (non lo è, dovrebbe essere chiaro a tutti) tu mi dici da quando a quando resterà in vigore &gt;&gt;";contro;;;
1423227494199615496;Seconda dose fatta, ora ho il green pass!!!!!!! Peccato che devo studiare e non posso viaggiare lo stesso.;pro;;;
1423227642568974337;"Comunque la media di vaccinazioni giornaliere è scesa a 432.169 somministrazioni, di cui solo il 33% sono prime dosi. Non c'è stato alcun effetto green pass, anzi, abbiamo smesso di vaccinare.
 #Covid_19";neutro;;;
1423227652014542852;"ero pimpante per le ferie ... ma ora ho un pippone da sbrigare .. il green pass per mia figlia, minorenne, vaccinata la prima volta, 6 gg fa
  ... ma che due coglioni !";neutro;;;
1423227711410122753;C’è la fila fuori dalle farmacie per stampare il green pass .. ma finora che avete fatto?;neutro;;;
1423227947226390532;Manca solo che per prelevare dal bancomat pretendano il Green Pass;contro;;;
1423228147332489222;Ma le spese per ulteriore personale per controllo green pass e per affrontare tutte le problematiche ad esso legate, saranno sostenute solo dai ristoratori? Ci saranno dei tornelli come nella metro? Che si è deciso? Fa un po' ridere e piangere il tutto.;neutro;;;
1423228196061855744;Ma perché non mi arriva sto maledetto green pass?;neutro;;;
1423229096750985218;Felicemente vaccinato io e moglie, e prima dose fatta ai figli, che ce lo hanno chiesto. In fila ai centri vaccinali ci sono più persone che alle manifestazioni contro il vaccino o il green pass... #sivax;pro;;;
1423229315802664962;dov’è il mio green pass;neutro;;;
1423229380386566147;"Dovevo andare ad un concerto il 3 settembre, peccato che se mettono il Green Pass obbligatorio me la prendo in quel posto come fossi una no vax.
 Mi sono ammalata, sono stata di merda, ho perso 3 mesi della mia vita per il Covid e a breve verrò esclusa da tutto. 
 Evvaaaaaaiiiiiiii";neutro;;;
1423230088766795776;ah ma sto cojone pensa davvero che si può entrare ai concerto solo con il tampone? ZI DEVI AVE IL GREEN PASS CHE COMPORTA 2 DOSI DI VACCINO ma questo ci è o ci fa;pro;;;
1423230463976615936;l’unica cosa positiva in tutta questa situazione green pass che non arriva è che finalmente ho imparato a memoria il mio codice fiscale;neutro;;;
1423231025455505415;Raga ma come si fa ad avere il green pass? Io ancora non ho capito;neutro;;;
1423231319237144586;"Il foglio che danno dopo che è stato completato il ciclo della vaccinazione non era già sufficiente come green pass?
 Perché devo fare un ulteriore certificato?
 

 Misteri italiani..";neutro;;;
1423231620379779075;"Chi espone ""no-green-pass da noi entrano tutti"" sta facendo concorrenza sleale verso i colleghi esercenti.";neutro;;;
1423231975846989829;devo scaricare il green pass, ovviamente neanche è arrivato nulla dopo la seconda dose;neutro;;;
1423232332299911168;"Mi rivolgo a #novax e #nogreenpass #vaccino #vaccinoCovid 
Facciamo così, torniamo al vaiolo per un mese e vediamo che succede ? ✌🏻";pro;;;
1423233117175914496;Con il green pass mi sento più sicura a tornare a vivere;pro;;;
1423233224319377409;"#Salvini: nessun Green Pass o limitazione per colazioni, pranzi e cene in albergo per i clienti delle strutture; nessun Green Pass o limitazione (almeno per tutto agosto) per i mezzi di trasporto, treni, autobus, navi ed aerei; garanzia di scuola in presenza per TUTTI i bambini.";neutro;;;
1423233770090639368;Ormai incominciano a dirlo anche le doctorstars televisive, persino #Crisanti: i green pass servono solo per spingere la gente a vaccinarsi, diversamente non servono ad altro, anzi possono essere pericolosi perché la gente crede di essere immune e non sempre lo è;contro;;;
1423233779276173314;Ragazze non fate scherzi vaccinatevi..io e mio marito già con green pass e mia figlia più grande ha gia fatto la 1 dose da 15 gg .....scelta pensata ma necessaria 💪#amemici20;pro;;;
1423233782895845376;Io a giugno ho smosso mari e Monti pur di vaccinarmi se attendevo la sanità della mia regione ancora non avevo neanche la prima dose. Non l’ho fatto per il green pass ma perché dobbiamo tutelare e tutelarci tutti #amemici20;pro;;;
1423233955487174658;"#vaccinoCovid Se ascolti un disco di #MarilynManson al contrario senti le cazzate della #Brigliadori.
#5agosto #satana #eleonorabrigliadori #novax #vaccino #vaccini #COVID19 #coronavirus #Covid_19 #BuongiornoATutti #buonGiovedi #VentagliDiParole #thursdaymorning #thursdayvibes";pro;;;
1423233990828437507;Comunque il mio #greenpass scade a ottobre (8 mesi dalla seconda dose) se per allora non si sarà deciso per la terza dose, rientrerò nella categoria di #novax coatto;neutro;;;
1423234194000449538;"‘Stanno morendo tutti’

No ma fatemi capire io come faccio a non capitare neanche per sbaglio nelle cazzate che scrivono i novax, c’è un metodo?";pro;;;
1423234603398144000;"#eleonorabrigliadori si è laureata in virologia all'Università di #Canale5. Chi siete voi per criticarla?
#5agosto #Brigliadori #novax #vaccinoCovid #vaccino #vaccini #Satana #novax #vaccinoCovid #vaccino #vaccini #BuongiornoATutti #buonGiovedi #VentagliDiParole";pro;;;
1423234740769939457;Se leggi al contrario i tw di Burioni ti appare un novax.;pro;;;
1423234880977063937;chi ha il green pass? l’altro giorno l’ho stampato ma ora mi sono accorta che forse è meglio tenerlo anche sul telefono, come posso fare?;neutro;;;
1423234896462499842;Vigliacchi imbroglioni, state usando i green pass solo per piazzare i vaccini, non ve ne frega nulla della gente. I green pass sono ingannevoli e non garantisco nulla. Maledetti state usando i giovani e tra un po’ i bambini per piazzare la vostra lurida mercanzia, siate dannati!;contro;;;
1423235194904059904;Raga il green pass si prende dopo la prima dose?;neutro;;;
1423235323660750858;come mai possiamo andare dal parrucchiere senza green pass ma non possiamo sederci in un bar cosa cambia i parrucchieri sono al chiuso;neutro;;;
1423235432926650374;Nonostante il decreto entri in vigore alla Mezzanotte, per il concerto di questa sera di Fabrizio Moro è necessario Green pass o Tampone fatto 48 ore prima. Se non avete una di queste due cose, non vi faranno entrare in teatro.;neutro;;;
1423235676716273667;Ci sono tante attività che si possono fare da soli, all’aperto e al chiuso, distanti da tutti. I #novax sono liberissimi di fare quelle. #greenpass #vaccini;pro;;;
1423235693854306315;Ma me lo danno o no 'sto green pass con una sola dose?;neutro;;;
1423235704776187904;"#Mattel ha realizzato una #Barbie ad immagine della creatrice del #vaccino #AstraZeneca. 
Poi se siete #novax per le vostre figlie magari un giorno troverete pure la Barbie #Brigliadori.
#5agosto #vaccinoCovid #eleonorabrigliadori #vaccini #satana #BuongiornoATutti #buonGiovedi";neutro;;;
1423235717937999872;OMG IL MINISTERO DELLA SALUTE MI PERMETTE DI AVERE IL GREEN PASS ANCHE SE VACCINATA ALL'ESTERO FUORI EU VAMOS BIGLIETTI PER NAPOLI;neutro;;;
1423235806337114112;io che riesco ad ottenere il green pass senza messaggio col codice FUCK THE SYSTEM;neutro;;;
1423236041339772932;"Barista di Alghero espone la stella di David in contrapposizione all'obbligo di green pass.

- Più del 70% della popolazione è a favore del vaccino
- Meno del 10% degli italiani è NoVax

Come decidere di fallire in qualche settimana.";pro;;;
1423236213293654019;che poi okay la gente che non si vuole vaccinare (ognuno è libero di fare quello che vuole quindi ahimè non metto parola su ciò)ma io penso che alla fine dovrebbero farlo per forza dato che c’è il green pass anche per portare fuori a pisciare il cane;pro;;;
1423236234789392387;"Fateci caso: quelli che se la prendono col Governo perché invia vaccini nei Paesi poveri, spesso sono gli stessi intelligentoni che non si vogliono vaccinare.

Lucillola @LucillaMasini
#5agosto #ilvocio #Governo #vaccini #paesipoveri #novax #complottisti";pro;;;
1423236404084105217;io ho il green pass ma non lo userò, rinuncerò a cinema teatro e ristorante, se tutti lo facessero sarebbe un buon segnale;neutro;;;
1423237169288818688;Mamma mia il disagio. Dopo i NoVax, anche i NoSilver e i NoBronze.;pro;;;
1423237183025160193;#lariachetirala7 Si parla di green pass per ristoranti treni bar e ora per andare a lavorare non entro nel merito ma mi chiedo non ho mai sentito parlare di green pass per i dipendenti di Camera e Senato e politicanti che frequentano i palazzi , tutti questi sono COVID free?;neutro;;;
1423238927947866113;"Leggo gente che parla di test salivari, di modificare regole per green pass.. 
 NO NON AVETE CAPITO NIENTE
 Non devono esistere né tamponi, né test salivari, né green pass...
 Se uno si ammala deve essere curato, punto. Se uno è sano, è una persona che non deve essere curata. Stop";contro;;;
1423238986873593857;Da domani obbligo di green pass e noi del Lazio stiamo nella merda. Bellissimo. 😊;neutro;;;
1423239609253773312;Mi sono appena mangiato un coglione (avvocato 50enne della Roma bene) no vax che si lamentava che non può entrare in palestra senza green pass da domani …;pro;;;
1423239646440562691;Possibile che una persona non possa raccontare la propria esperienza senza venir attaccato e per questo costretto a chiudere i commenti? Fanno paura i #novax? No a me fa più paura chi vuole azzittire le persone come fanno i fanatici del #vaccino solidarietà a #Crosetto;contro;;;
1423239925269516289;"AZIONI LEGALI CONTRO IL GREEN PASS
 SIA CIVILE CHE PENALE
 risarcimento dei danni
 ricorsi per sanzioni amministrative
 carlo leoni whats app 3248341744 email comitatodifesadelcittadino@gmail.com con i vostri dati...";contro;;;
1423240010233430017;da domani green pass obbligatorio spiace per LUII;neutro;;;
1423240057037729796;"Voglio una cover per il cellulare con stampato sul retro, a colori, in filigrana il Green Pass.
 Lo trovo pratico, ma soprattutto chic, di uno chic folle.";pro;;;
1423240253809246209;ci mancava il novax che mi scassa i coglioni;pro;;;
1423240335401103360;Ho scaricato #verificaC19 e ho scoperto di avere due green pass, entrambi validi: uno per guarigione da Covid e uno per doppia vaccinazione. Chissà se sono un caso unico;neutro;;;
1423240392863109120;"raga un'informazione: c'è qualcuno che ieri è andato al cinema e ha dovuto mostrare il green pass? mi servirebbe saperlo, grazie &lt;3";neutro;;;
1423240457702813698;"Comunque mi fanno ridere quelli che ""con il green pass avranno tutti i nostri dati! NO AL GREEN PASS"" poi hackeraggio alla regione lazio e silenzio😐";pro;;;
1423241273054478346;Come scaricare certificato Green pass;neutro;;;
1423241480093720579;"il vaccino di ieri mi ha distrutta, è il 5 agosto ed ho una coperta normale+una di pile addosso
 però mi è arrivato il green pass completo";neutro;;;
1423241528512757761;"ah ma domani diventa obbligatorio il green pass e quei cessi di alcuni miei """"""amici"""""""" non sono vaccinati OH COME GODO IO COL MIO GREEN PASS ARRIVATO IERI";pro;;;
1423241598935121924;"per gli esercizi commerciali non è un optional verificare che gli avventori abbiano o meno il Green Pass da domani, 6 agosto.
 quei cartelli che si trovano in giro “da noi non è richiesto Green Pass” sono incommentabili quanto i #furbetti che li hanno scritti #vergogna 
 #greenpass";pro;;;
