id;tweet;stance;;;
1423567782092943366;"Cioè ma cosa vi danno in più con il Green pass che già non avevate?
 

 Se parlano di NUOVA NORMALITÀ mi dovete dire esattamente le cose in più che ci sono rispetto alla VECCHIA NORMALITÀ. 
 

 PIÙ SOLDI, PIÙ BENESSERE, PIÙ LIBERTÀ, PIÙ VITA? NO, ADDIRITTURA DI MENO. E VOI CI STATE!";contro;;;
1423567942273454080;A me fa piacere che a tutti gli utenti di Twitter sia arrivato subito il green pass no problem, ma a me non hanno mandato un grancazzo di nulla ancora;neutro;;;
1423568096300879873;cioè dopo la prima dose non mi hanno dato il green pass,mi sono presentata la e mi hanno cacciata,hanno detto che ogni volta che devi fare qualcosa pure se sei vaccinata con entrambe le dosi devi fare il tampone e allora vaffanculo;neutro;;;
1423568171609595905;Questo green pass ha l’aria di essere prima di tutto un “contentino” per chi si è sottoposto alla sperimentazione vaccinale laddove il siero, nonostante tutti i rischi che comporta, non risulta essere efficace. Prima o poi ci arriveranno tutti;contro;;;
1423568224793268228;#GreenpassObbligatorio per chi è vaccinato oltre al green pass chiederei anche il referto del tampone giusto per essere sicura che chi si siede vicino a me (non sono vaccinata per motivi di salute) non sia positivo, visto che chi è vaccinato non è Immune al virus;neutro;;;
1423568231256711171;"Sono andato in palestra e ho esibito il Green pass.
 

 Risposta : "" Va bene, ma chi cazzo sei ? """;neutro;;;
1423568237833433088;"comunque io godo assolutamente per il green pass obbligatorio per le università, perché stavo proprio discutendo con una mia amica che è contraria ma solo perché ovviamente non è vaccinata
 e anche il costo del tampone, si forse è un po' tanto, e lo abbasserei, ma gratuito no, +";pro;;;
1423568258586845187;comunque queste olimpiadi mi hanno fatto capire ancora di più quanto mi manca fare sport e green pass permettendo vorrei tornare in vasca a settembre 🤞🏻🍀;neutro;;;
1423568279046696970;Da possessore del green pass e da persona abituata a portarsi avanti: ma chi ha prenotato un viaggio mesi fa, quando non si sapeva nulla di GP o tamponi risalenti alle 48 ore precedenti, da oggi rischia di non poter viaggiare?;neutro;;;
1423568346809880576;Successone di Salvini su Draghi: dei suoi 5 punti sul green-pass non ne è passato neanche uno. Ma lui è felice lo stesso,sostiene di aver “salvato Agosto”. Si accontenta di poco, visto che Draghi aveva già deciso l’applicazione per il 1mo Settembre!;neutro;;;
1423568355915673600;Vediamo in quanti chiederanno il Green pass in quel buco di culo del mondo che è il mio paesino in Sicilia;neutro;;;
1423568536404901888;"⚠️ ATTENZIONE: Post ironico ⚠️

Speriamo che i #novax abbiano torto!

Immaginate se i v.a.c.c.i.n.i. ci sterminassero e loro, unici sopravvissuti, dovessero ripopolare il pianeta?

@RobertoBurioni 

#DittaturaSanitaria #noncennecovvidi #BigPharma #terrapiatta";neutro;;;
1423568544705437696;"I migliori sono quelli brutti come la morte, un mix tra Orfini e Parenzo, che dicono ai novax: ""Io quest'estate vado per locali e mi diverto!!1!"" 
#cringepass #greenpass";neutro;;;
1423568644995526657;per quale motivo chi è vaccinato Astrazeneca con prodotto fatto in INDIA non può avere il green pass? se ho copertura fatta altrove che cosa c'entra con Approvazione EMA ? si confonde business con altro mi pare @radio3mondo;neutro;;;
1423568846850609156;"‘Preferisco morire che possedere un lasciapassare’

Iniziamo una nuova entusiasmante giornata con le perle dei novax";pro;;;
1423569104183734272;Quando non sanno più con chi prendersela i fascisti se la pigliano con i nazisti che hanno inventato il green pass.;neutro;;;
1423569113033715712;Ma se non gli diamo il green pass, non è obbligato a restare, Romelu?;neutro;;;
1423569237386354690;Ho fatto il vaccino perché volevo andare in Croazia al mare, questo era lo scopo del green pass, muoversi tra gli Stati e non muoversi per andare al bar o al ristorante!;neutro;;;
1423569295376801792;"Una mattina,
 mi son svegliato,
 o bel green pass
 o bel green pass
 o bel green pass pass pass...";neutro;;;
1423569537555996675;"Il DL sul green pass è la più grande vergogna dai tempi del nazismo.
 

 Draghi considera corpi e diritti costituzionali dei cittadini sua proprietà privata fottendosene di Costituzione e norme UE.
 

 La reazione a questo schifo deve essere fortissima!
 

 #NoGreenPass";contro;;;
1423569541267742720;"Sto aprendo un'agenzia di pompe funebri fra 18 mesi sarò riccoooo!!! 

Oh cazzo, mi son vaccinato anch'io!

( Pietro Ingargiola @pierobricio )

#6agosto #Brigliadori #covid #vaccino #vax #novax #COVID19";neutro;;;
1423569678543298561;Bisognerebbe lasciare i #novax nella loro convinzione...quando si presentano in ospedale dico;pro;;;
1423569690815782914;"Io vorrei sapere se la certificazione vedere che mi è arrivata dopo la seconda dose di vaccino è il Green Pass.
 

 E, se sì, vorrei sapere che problema ha questo paese nel rispettare la f0ttut4 terminologia esatta. 
 Se è certificazione verde NON È Green Pass.";neutro;;;
1423569805899141122;"ma sono l'unica a non aver ancora ""scaricato"" il green pass perché non capisco come si fa?🙃";neutro;;;
1423569858738987011;Primo giorno di Green Pass prima discussione con una che si lamenta perché non può mangiare al mc seduta dentro...;neutro;;;
1423569919468257281;Cazz ho il tolc in presenza il 30 agosto e non sapevo servisse il green pass... La prima dose l'ho letteralmente il giorno dopo;neutro;;;
1423570047902048266;Mia figlia in cinta non può vaccinarsi. È andata a fare il tampone perché il marito vaccinato ha avuto contatti con una testa di cazzo positiva che non vuole vaccinarsi. i #Novax non capiranno quanto sono pericolosi finché non  prenderanno calci in culo.;pro;;;
1423570109155713025;Se il gestore di un'attività è #novax o simpatizzante, non chiederà mail il #greenpass Abbiamo un riferimento per denunciare il tutto? Glissiamo sul fatto che per entrare devo esibirlo ma per lavorarci non sono obbligato....;neutro;;;
1423570424449875968;Raga ma davvero devo aspettare 15 giorni dopo la prima dose per avere ‘sto cazzo di green-pass? Ditemi che in farmacia me lo scaricano subito😭;neutro;;;
1423570432540692483;A Gardaland non ho trovato, finora, una sola persona contraria al green pass. Tutti in fila con il certificato pronto! #greenpass;neutro;;;
1423570499154726917;"Haiku della barista e dell'ultraottantenne
 ""Buongiorno ha il green pass?""
 ""Si a casa""
 ""Bon si sieda pure""";neutro;;;
1423570898267906048;ho stampato il green pass ✌🏻🥳;neutro;;;
1423571005159641089;PIENA DI QUESTO GREEN PASS DI MERDA CHE NON ARRIVA PIENAAAA PIENAAAAAAAAA;neutro;;;
1423571022947700738;"Appena intervistato da @SkyTG24 causa fila per controllo Green Pass; ho perorato la causa del ritorno allo stadio con la stessa modalità. Speriamo lo mandino in onda 😉";neutro;;;
1423571102345924610;"Se vale il lemma 'la tua libertà finisce dove comincia la mia'
Allora tu #sivax non puoi rompere i coglioni a un #novax.
Le lamentele viaggiano ai piani alti verticalmente e non sullo stesso orizzontalmente.
REGOLA NUMERO 1
Per cui prenditela col governo
#NoGreenPassObbligatorio";contro;;;
1423571123296509952;Mi è già arrivato il green pass delle due dosi, sono una donna liberaaa;neutro;;;
1423571250027323392;Già beccato il primo posto a Siracusa dove “Ma quale green pass, Draghi mandi qualcuno che controlli, mica ci mettiamo noi a vedere se uno ce l’ha o no”.;neutro;;;
1423571350359248896;"La ragazza di mio fratello ha ben pensato di dirci: ""Beati voi che avete il green pass""
 BeAtI vOi 
 bEaTi VoI 
 

 Io e i miei genitori che abbiamo avuto il covid per un mese: 👁👄👁";neutro;;;
1423571370726809606;Hanno chiesto green pass al bar e in palestra che sogno forse una favola;pro;;;
1423571387386576902;raga se io devo andare in Francia posso presentare il green pass italiano o devo convertirlo in quello europeo? ho capito poco sulle faq varie che ho letto;neutro;;;
1423572155338534915;"Green Pass o meno, la frase del ministro Overton Speranza è chiarissima: ""Abbiamo dosi a sufficienza per fare la 3a dose e aspettiamo indicazioni dal Cts per sapere il tempo giusto per somministrarla. Le prime indicazioni ci lasciano presupporre che si inizierà dai piu fragili""";neutro;;;
1423572392643813377;Indovinate chi ha perso la stampa del green pass, ora dovrebbe rifarsela, ma la stampante ha ben deciso di non funzionare;neutro;;;
1423572464446185478;"Novax/nogreenpass: Telefono, prenoto e poi non vado
Ristoratore: deve versare un acconto alla prenotazione di 5 euro a persona che sarà scalato dal prezzo finale della cena, iban/p.pay o paypal?";neutro;;;
1423572536051253250;Ma secondo voi Mika ha il green pass? Lui lo può avere?;neutro;;;
1423572652204167173;Il 4 giorno dopo il vaccino è ancora niente Green pass. 😡#Lazio;neutro;;;
1423572934552178699;Green pass ora, per zona a colori domani.;neutro;;;
1423573001535201281;"Prima del covid le giustificazioni erano richieste ai malati agli assenti ai criminali. Cioè dovevi dimostrare un errore una falla una stortura. 
 

 OGGI CON IL GREEN PASS RICHIEDONO LA GIUSTIFICAZIONE AI PRESENTI AI SANI AGLI ONESTI.";contro;;;
1423573104740245504;Visto che il green pass, nelle chiese e negli oratori non è richiesto, andrò a mangiare alla mensa della caritas e al cinema dell'oratorio.;neutro;;;
1423573113867022349;"""Dopo un incontro durato circa 3 ore, viene approvato all’unanimità in Consiglio dei ministri un nuovo decreto legge, in piena continuità con il decreto sul Green pass...""
 Ancora dubbi su #Salveeeeeeni che spara cazzate fuori dal cdm e poi si adegua per la #cadrega?";neutro;;;
1423573222369411073;Perché green pass ovunque e non nei supermercati????;neutro;;;
1423573563907493891;voglio andare da qualche parte per esibire il mio bellissimo green pass vi giuro non vedo l’ora che goduria;pro;;;
1423573690432770048;Ah ma quindi oggi per andare a prendere un caffè al bancone, distanziato e abbassandomi la mascherina per mezzo secondo giusto per bere, dovrò mostrare il mio Green Pass?;neutro;;;
1423574008038051843;Vabbè, ma i novax possono sempre mangiare ai tavoli fuori, manco gli stessero vietando di andare al ristorante;neutro;;;
1423574061230313477;Sono super felice vedere chi riesce a vaccinarsi ma mi viene anche un Po di rabbia perché io non sono riuscita ancora a prenotare nulla e da oggi con il green pass e diventato tutto più difficile. Voglio vaccinarmi!;pro;;;
1423574651993796613;"Fuori dai ristoranti adesso ci sono i bagarini:""Compro-vendo #greenpass, compro-vendo green pass.""";neutro;;;
1423574737612165122;Il green pass obbligatorio per andare al ristorante ma non per lavorarci ok dai;neutro;;;
1423575092798410752;"Insopportabile il modo in cui Borghi si scusa e parla del green pass dalla sua posizione privilegiata, essendo consapevole che non verrà toccato dalla norma.
 Voi che gli mettete like e lo ringraziate a vostra volta siete peggio di lui.
 Se è un vero uomo, ora esce dal partito.";neutro;;;
1423575123983052801;"Ma quelli di Forza Nuova che sono contro il green pass come faranno a entrare in bibliotecah no niente non ci andavamo manco prima. 
 

 #ForzaNuova #greenpass #vaccinoCovid #COVID19";neutro;;;
1423575167838662656;La sinistra condanna chiunque la pensi al contrario su qualsivoglia questione. La destra contrasta ma (ahimè) fa quel che può, di norma non brilla. Forza Nuova obbliga gli iscritti a non scaricare il green pass. Tutti a parlare di dittatura. Ognuno la mette in atto diversamente.;neutro;;;
1423575208984711168;"- non serve al bancone il green pass
 ~ non importa, lo devo far vedere a qualcuno";neutro;;;
1423575236109291523;"A noi ci chiedono per l emergenza e contro la diffusione..vaccino.. tamponi A PAGAMENTO e green pass...poi arrivano barconi ed ong con gente senza vaccino e tamponi gratis allo sbarco...
 L'italiano dorme..";neutro;;;
1423575301397823491;È ufficiale. Gli italiani sono un popolo di imbecilli. La mattina un tipo si svegliano e anziché raccudinarsi su la bava, decidono di andare a infastidire il barista col green pass. Dopo essersi genuflesso davanti al Papa e a Mattarella, si renderà conto di essere un miserabile?;neutro;;;
1423575438614532098;Ragazzi ma esiste un app per avere il green pass a portata di mano sul cellulare?;neutro;;;
1423575533472919561;Ricordiamo ai #novax che #Salvini e #Meloni si sono #vaccinati,e che della salute dei #novax se ne sbattono evidentemente i coglioni,sperano solo che possiate campare abbastanza a lungo per votarli 👍🏻👍🏻👍🏻🍷;neutro;;;
1423575549130199043;"Esperimento di pensiero.

Premessa: io non credo che si possa dire che ""i novax dovrebbero pagarsi le cure"", se non altro perché poi bisognerebbe allargarlo a tutti gli stili di vita non idealmente sani (fumo, cibo, sport pericolosi).

Ma comunque ecco il dilemma.";neutro;;;
1423575684216238080;buoni tutti che forse dopo due mesi di attesa riesco ad avere il green pass;neutro;;;
1423575686044860417;Arriva il Green pass è arrivano i concerti promessi agli artisti che si son prestati.;neutro;;;
1423575736607182854;non avendo il green pass ho una scusa per non andare a scuola in effetti;neutro;;;
1423575739895590914;"Il Green Pass non sarà obbligatorio per le messe ed oratori estivi, etc.
 

 Che “Dio” protegga queste vostre dannate scelte.";neutro;;;
1423575835081166849;Salvini: cambieremo il green pass dall'interno!;neutro;;;
1423575932955205636;"Seconda dose fatta.
Per i novax fra 18 mesi dovrei crepare quindi nel dubbio abbandono tutti, faccio la valigia e apro una panzerotteria nelle Hawaii.
Almeno schiatto felice";neutro;;;
1423576015410970628;cosa ho fatto per essere circondata dai novax;pro;;;
1423576103239700484;quanto ci mette ad arrivare il green pass 🧍🏼‍♀️;neutro;;;
1423576129114411011;Che poi forse non arriverò io a capire ma comunque col Green pass adesso si ha una sicurezza in più, che quello accanto a te abbia almeno provato a proteggere sé e gli altri mentre fino a ieri no, quindi non capisco quest'aria da apocalisse imminente che vi pervade.;pro;;;
1423576276401524739;Allora io ho fatto il vaccino martedi, devo aspettare sms o richiederlo io il green pass?;neutro;;;
1423576286329544706;"Si potrebbe riavvolgere il tempo e provare l'altra via: negare la pandemia; no lockdown; no distanziamento, mascherine ecc; no zone rosse, arancioni, gialle; no vaccini; no green pass. E ci vediamo su Twitter il 6/8/21 dell'altra linea temporale, se siamo ancora vivi #greepass";pro;;;
1423576373625503744;Scusate, anche per entrare qui c’è l’obbligo del GREEN PASS?;neutro;;;
1423576490201993217;"helloo
 ma voi vi siete vaccinati? avete il green pass?🏃🏻‍♀️";neutro;;;
1423576541477412867;"Io che entro in un bar per un caffè e mi chiedono il green pass, io che non ho il green pass con me, pur essendo vaccinato torno a lavoro senza caffè 
 :(";neutro;;;
1423576708133892097;prima discussione (molto civile) con commessa di negozio di abbigliamento di fronte a bar con cartello “qui non chiediamo il green pass” controllato da polizia;neutro;;;
1423576812240703489;il green pass mi scade a fine settembre e a metà novembre ho le visite per l’allergia e chiedere se posso fare il vaccino o meno;neutro;;;
1423577015735787523;"Un’altra idea, un anello chevalier con il QR code del Green Pass.
 

 Dai che parte subito il business";neutro;;;
1423577032773050369;#lariachetirala7 che senso ha il non Green pass sui mezzi pubblici? Perché sono usati maggiormente dai vs amici giargianesi? Siete delle merdacce dem;neutro;;;
1423577332187549696;WO mi è già arrivato il green pass😎;neutro;;;
1423577414622384128;Impedire agli iscritti a Forza Nuova di fare il green pass è un altro colpo ai lavoratori della cultura, che così perderanno lo 0% dei loro introiti.;neutro;;;
1423577510500093955;"Ai tempi del fascismo ...se eri ""Ebreo"" non potevi insegnare e venivi allontanato dalla scuola...

100 anni dopo...succede se sei #novax.. 

Ai tempi del fascismo...il posto di lavoro era sacro ed inamovibile...

100 anni dopo,ti licenziano con un messaggio";contro;;;
1423577515487109121;buongiorno mi tocca seriamente leggere di deficienti che paragonano il green pass alla tessera fascista ma cosa avete nel cervello;neutro;;;
1423577577525026816;Già che ci siete fate il green pass a punti: Una dose=un punto e così via. Poi tutto seguirà naturalmente fino alla patente del buon cittadino.;neutro;;;
1423577603160612874;"""Perché ti sei vaccinato?""
Perché lo hanno fatto tutti...

Questa la risposta di un mio amico, declassato a conoscente e molto presto sarà declassato a semplice passante.

#greenpass #novax #vaccini #nogreenpassobbligatorio";contro;;;
1423577612111261697;"Io lo sapevo.
 Sentivo che oggi mi avrebbero incastrata a stampare green pass agli over 60";neutro;;;
1423577717090435075;"cari ristoratori
 giustamente vi incazzavate che vi facevano chiudere.
 Oggi vi fanno lavorare, anche al chiuso, vi chiedono di perdere un minuto a tavolo per scansionare un green pass e visionare una carta di identità.
 Ergo, non rompete il cazzo";pro;;;
1423577807087673344;"#novax #provax #NoGreenPass #greepass #GreenpassObbligatorio per tutti i estremisti da entrambe le parti. si criticano le idee e no si insultato le persone.
Mi fa ribrezzo quello che scrivono certe persone";neutro;;;
1423577889992286213;"Forte tentazione di dire al prossimo che chiama per chiedere se è obbligatorio il green pass ""vaccinati e non rompere i coglioni""";pro;;;
1423577927569055754;"Da inizio anno a oggi con la lega al governo sono entrati in Italia da est via terra da sud barconi oltre 50 mila clandestini più vaccinazione obbligatoria cammuffata da green pass più licenziamenti tramite WhatsApp 
 Forse se rimaneva all'opposizione era meglio";neutro;;;
1423577982849933313;Appena sfoggiato green pass per entrare a Mc Donald’s ✌🏽;neutro;;;
1423578100894519299;"al chiosco con mamma e sorella, entra una signora che comincia a dire ""OH GUARDA HO IL GREEN PASS, SONO VESTITA TUTTA DI VERDE"" 
 

 dio santo";neutro;;;
1423578157706358784;Ho esibito il primo green pass. È stato veloce e liberatorio come quando il profe ti interrogava a sorpresa ma tu gongolavi dentro perché la sapevi.;neutro;;;
1423578428482244609;"Il problema in cui siamo può essere risolto o richiudendo le regione (Sardegna, Sicilia e Lazio stanno ritornando gialle) o usiamo il Green Pass, che oggi finalmente entra in vigore.
 Se ne faremo tutti tesoro risolveremo insieme questa situazione.
 #GreenPass #Ripartenza";pro;;;
1423578463445917696;Scusate ma una domanda sul green pass: se una persona si siede ai tavolini esterni del bar non ha bisogno di esibire green pass però poi per pagare deve entrare nel bar, giustamente.. quindi gli si chiede il GP o niente? Idem se una persona sta al banco a bere un caffè, GP Y/N?;neutro;;;
1423578546438643713;Io penso che con questo Green Pass siamo agli albori del microchip ...che verrà installato sull uomo che vorra' acquistare commerciare muoversi..il famoso segno della bestia..;contro;;;
1423578573806477313;Ok tu metti il cartello green pass davanti al tuo ristorante però i soldi sono i miei e li spendo dove cazzo mi pare ora potete pure fallire me ne fotto;contro;;;
1423578637685694464;Bello dover litigare da mezz'ora con il sito per recuperare il mio green pass, visto che mettono quei cazzo di captcha di merda inaccessibili e quelli audio non si capisce un cazzo ed è mezz'ora che cerco di decifrare captcha senza successo che belli i servizi inaccessibili;neutro;;;
1423578790396145665;Ma quindi è già in vigore il green pass amici???;neutro;;;
1423578811933806592;"*CHIUNQUE: “Ma il Green Pass è costituzionale?”
 

 *STUDENTE DI GIURISPRUDENZA: “Dipende”";neutro;;;
1423579139857166336;Primo giorno di #Gardaland con GreenPass: tutti ordinati, green pass alla mano, zero polemiche, zero urla, zero problemi. I novax sono rumorosi ma fondamentalmente pochissimi, avanti con la vaccinazione;pro;;;
1423579424038006785;"Il green pass è un formidabile strumento di controllo di massa benedetto da tutti i partiti della maggioranza LEGA COMPRESA
 Potrò sapere che ristoranti frequenti 3,4,5 stelle, quanti viaggi fai, dove vai, in quale classe ? Turistica oppure prima ? .......";contro;;;
1423579472100577280;fa ridere perché tutti quelli che criticano il green pass per l’università sono casualmente tutte persone che non frequentano l’università;neutro;;;
1423579911080587264;non mio fratello che si sta facendo il green pass su telegram😭😭😭;neutro;;;
1423580292598702086;Mi piace l’odore del green pass al mattino. #GreenpassObbligatorio #greenpass;pro;;;
1423580332591288323;"- Ah ma ci vuole il Green Pass? 
 - Va bene anche il passaporto diplomatico.";neutro;;;
1423580374928613381;Comunque, a quel paese ci potete andare anche senza green pass.;neutro;;;
1423580467354275840;"primo bar al chiuso in cui vado oggi primo giorno di green pass: nessuno mi ha chiesto nulla
 

 iniziamo bene";neutro;;;
1423580499356827648;Moretti se il Green pass è un obbligo risulta un obbligo anche il vaccino. Ma ci arriva? #lariachetira #lariachetirala7;neutro;;;
1423580507472859141;Domandella seria: se ho il vaccino l'11 e il 12 partiró, non avrò subito il green pass però avrò fatto entrambe le dosi quindi, posso mostrare il documento che attesta che sono vaccinata oppure dovró fare comunque il tampone rapido?;neutro;;;
1423580538946850819;"DOMANDONA
 

 Sei vaccinato, 
 domani cominciano le ferie, si parte finalmente.
  
 Ma sei raffreddato, con un po' di febbre, leggermente spossato. 
 

 Però hai il green pass. 
 

 Che fai? 
 Tamponcino per farti le ferie in quarantena?";neutro;;;
1423580575303151624;Bello avere il green pass comunque;pro;;;
1423580656328708099;"Dimmi che sei sfigato in qualsiasi ambito senza dirmi che sei sfigato in qualsiasi ambito.
 Inizio: ho la prima dose del vaccino ma ancora non ho il green pass";neutro;;;
1423580809802489858;QUANTO È BELLO SFOGGIARE IL GREEN PASS PER LA PRIMA VOLTA QUANTO È BELLO;pro;;;
1423580830979481602;Da oggi obbligo green pass e lo sto ancora aspettando da quasi 3 settimane ✨✨✨;neutro;;;
1423581159536144387;prima cosa fatta col Green pass entrare nella casa di Boccaccio a Certaldo, Matteo salvini soffrimi;neutro;;;
1423581171045253121;Sul mio gruppo dell'università tutti indignati per l'obbligo di green pass per entrare🤡 statevene a casa che non fate danno a nessuno;pro;;;
1423581306152230913;"Primo effetto del Green Pass 6 Agosto. In palestra:
 

 ""Buon giorno, buon allenamento""
 

 (E il greenpass?)
 

 Non ha chiesto niente nessuno (magari per ora)";neutro;;;
1423581370278895618;Dovrò lavorare al bar per due settimane e vi giuro ho l’angoscia al pensiero delle situazioni tese che avrò nel locale per colpa del green pass. La gente è fuori di testa, i social sono pieni di persone che dicono che se lo chiediamo possiamo anche fallire.;neutro;;;
1423581383637745665;Ma ci vorrà il green pass pure per andare a fare il tampone? Chiedo per un amico pignolo;neutro;;;
1423581384397017093;"Credevo che The Following fosse solo una serie televisiva

#novax 
#nuoviguru";neutro;;;
1423581391103610882;"Lo sbugiardato difensore della razza #Salvini: &lt;&lt;Qualcuno voleva il Green pass anche per farci andare in bagno, io credo che siamo invece riusciti a togliere un bel po’ di problemi a milioni di italiani&gt;&gt;. E anche al #Covid.";neutro;;;
1423581553184149505;"Per accedere ai miei DM non è richiesto green pass.
 Il tampone lo offro io.";neutro;;;
1423581669852913667;Esausta del gruppo dell'Università che non fa altro che lamentarsi dalla mattina alla sera delle decisioni sul Green pass e della rettrice. Sicuramente se mandano 100 messaggi al secondo non risolvono un cazzo 🥴;neutro;;;
1423581908877910019;----quelli che non vogliono fare il Green Pass si organizzano per andare a suonare i campanelli a quelli che hanno il Green Pass.;neutro;;;
1423582030915325952;Non vorrei deludervi ma green pass o chiusure è letteralmente un discorso da zero covid. Poi se vi fa sentire meglio dare degli stronzi agli altri okay;neutro;;;
1423582056005636101;"URGENTE!
 

 Chi di voi ha già scaricato il green pass? A me inviarono il codice ancor prima di fare la prima dose. Ora sto provando a scaricarlo ma mi dice che il numero non corrisponde alla tessera sanitaria. 🤦‍♀️";neutro;;;
1423582732593020928;🤔 ma il vaccinato che rifiuta la #terzadose viene etichettato come #novax , #quasivac , #semivax ? 🙄;neutro;;;
1423582743137595392;Finalmente dopo ore e ore sono riuscita a scaricare IL GREEN PASS YEEEEEEEEE;neutro;;;
1423582758278991874;"Sta storia delle fiaccolate, delle manifestazioni non autorizzate, delle riunioni in piazza senza mascherine contro il green pass sta degenerando, travalicando il consentito.
 È soltanto la destra che è tornata a manifestarsi sotto tutte le sue forme.
 #GreenpassObbligatorio";pro;;;
1423582862440378370;Ore 11:52, ancora non sappiamo come fare per il green pass, perché il mio capo reputa più importante dormire;neutro;;;
1423582905671077888;ma anche con solo la prima dose ti danno il green pass?;neutro;;;
1423582906623184896;Ai cari “amici” #novax #nogreenpass non vi é ben chiaro il concetto di dittatura 🌝;pro;;;
1423582932774572032;Ho dato un'occhiata al gestionale delle prenotazioni della palestra che frequento quotidianamente da 6 anni. Tra mercoledì e oggi i prenotati sono meno della metà. Cambiamenti avvenuti? Green pass obbligatorio;neutro;;;
1423583008133615617;ma vaffanculo voi e il green pass;contro;;;
