id;tweet;stance;;;
1423681656695754753;Accidenti! Ho appena scoperto che poter accedere a un cinema all’aperto, che non richiede di indossare la mascherina occorre il Green pass! Devo trovare un gruppo che mi insegni a preparare le molotov;neutro;;;
1423681758277611522;Vedrete che tra un mesetto il paese terminerà in zona gialla molti saranno costretti a chiudere sinché nn falliranno,senza pensare che perderanno molti clienti senza green pass....povera Italia.;neutro;;;
1423681957972545540;raga ma per chi ha solo la prima dose come si scarica il green pass?;neutro;;;
1423682176927866891;"Pensionato si è fatto fare la foto con il green pass nel bar: “come i carcerati”.
 Tutti a Bari stanno😂";neutro;;;
1423682210117398539;Che queste nuove leggi sul green pass come funziona per qualche infermiere ancora nn e vaccinata/o? Gli insegnati sono stati obbligati a vaccinarsi 🤷🏻‍♂️;neutro;;;
1423682363519811584;Sono alle prese con mia mamma che dice “devi far stampare il Green pass in farmacia!” e io “ma non serve! Basta avere l’app Io con il codice!” 🙄🙄;neutro;;;
1423682435653439491;Oggi la borsa di Milano ha festeggiato, inspiegabilmente. Capito chi impone il green pass?;contro;;;
1423683963365859336;Se pensavate che noi nel campo del costumer service specialmente legato al cibo venissimo trattati male prima, ora col green pass think again. Sia chiaro che la mia NON È una lamentela al green pass, quanto all'ignoranza del cliente medio.;neutro;;;
1423683983099957249;dopo quanto tempo vi è arrivata la mail per poter avere il green pass???? ci stanno mettendo un po’;neutro;;;
1423684156417003528;Ora escono i tweet palla, i miei soldi al ristorante non li vedono più. O altre cazzate varie. Questi non cacciavano un euro, manco prima della pandemia. Ma poi i no vax, i no green pass, ora vogliono mangiare solo al chiuso. Bugggiaard;neutro;;;
1423684209953157128;"I novax che si strappano i capelli per l'università ignorano forse che la tonsura non è più necessaria.

#GreenpassObbligatorio";neutro;;;
1423684230446522375;"Oggi al ristorante, la proprietaria a dei clienti: ""se non avete il green pass non potete entrare""
 ""Eh ma lo abbiamo lasciato a casa""
 Tipo i bambini delle medie quando non hanno i compitini";neutro;;;
1423684368212664322;"vorrei dire ai novax che parlano tanto di dittatura di aprire un libro di storia o di farsi raccontare dai propri nonni cos'era davvero la dittatura. 
terrore, ecco cos'era, e se pensate che un vaccino sia una cosa da dittatura siete solo ignoranti.";pro;;;
1423684532537016320;Quindi, il dipendente novax delle piccole realtà continuerà a frequentare il suo posto di lavoro mettendo in pericolo il proprietario vaccinato ma che a casa ha un soggetto fragile non vaccinato...bene. una stronzata il #GreenpassObbligatorio che non fa la sua funzione;neutro;;;
1423684838511583240;Giorno 1 del green pass e già ho perso il cartaceo e sono corsa in farmacia a rifarlo perché io dall’app non posso averlo la vivo molto bene sta cosa;neutro;;;
1423684952034525189;Ragazzi ma il green pass per l’Italia è valido da subito dopo la seconda dose o bisogna aspettare 14 gg?;neutro;;;
1423685055147397123;Il Green Pass è obbligatorio per partecipare alle funzioni religiose che si svolgono al chiuso? @pdnetwork @LegaSalvini @M5S_Camera @ivanscalfarotto @forza_italia @FDI_Parlamento;neutro;;;
1423685101007876096;"Cioè un ristorante che è gestito da amici di vecchia data ha deciso di non richiedere il green pass. Io non capisco davvero, vi facevo più intelligenti 😳
 Vuol dire che come non ci sono mai andata finora, mai ci andrò in futuro.";neutro;;;
1423685340016021507;il green pass nelle corriere è obbligatorio?;neutro;;;
1423685539342032902;Oggi in piscina mi hanno chiesto il green pass per entrare, robe da pazzi! Rispettano la legge! E magari pagano pure le tasse! Dove andremo a finire, a buongiorno e buonasera?;neutro;;;
1423685825099927552;Vi racconto una cosa. Paziente che ho seguito in due gravidanze, affezionata, l'ho aiutata a far nascere due figli, sempre generosa di complimenti, auguri, simpatia. Oggi ho detto che sono favorevole al Green pass, mi ha tolto l'amicizia (su Facebook). Ditemi voi se è normale.;neutro;;;
1423685891864907781;La cosa migliore è avere il Green Pass e non volerlo esibire al primo cameriere che incontri.;neutro;;;
1423685923015962628;mezza giornata per capire come fare ad avere il green pass dato che non mi è arrivato nessun codice e se entro con lo SPID mi dice che non c’è nessun certificato per poi andare in farmacia e averlo stampato in 5 secondi BOH;neutro;;;
1423686163953508356;Lo ribadisco: la Lega è un Green (S)pass(o).;neutro;;;
1423686233314807814;"Draghi: ""Vaccinatevi e non rompete le balle."" (e ringraziate il cielo che abbiamo i vaccini)  #novax #GreenpassObbligatorio";pro;;;
1423686264402894851;"Ricordo ai #novax che quando pe anna' a scopa' ve prendevate la pillolina blu, era sempre della #Pfizer 

#NoGreenPassObbligatorio";pro;;;
1423686292219564033;Accendete Rai radio 1…. Le manifestazioni anti green pass sono dei flop….. sembra di sentire quando la radio comunicava che le truppe italiane erano alle porte del Cairo….. che schifo …..;neutro;;;
1423686307973419009;Dovrei fare una lista con le cazzate che ho sentito uscire dalla bocca dei novax negli ultimi mesi, da rileggere quando mi annoio e ho voglia di arrabbiarmi;pro;;;
1423686329863393290;ma in che senso il green pass arriva QUINDICI GIORNI DOPO aver fatto il vaccino ahahhashdhasdjaskdas;neutro;;;
1423686635640741898;sta sera vado a cena fuori e son prontissima a sfoggiare il mio green pass;neutro;;;
1423686847419535366;Le discussioni sul Green Pass mi hanno fatto capire che tutti sono l’italiano medio di qualcun altro;neutro;;;
1423686950628757508;"#6agosto #COVID19 ma perché i #novax che hanno attività ma non riconoscono la pandemia e quindi anche la crisi economica conseguente hanno richiesto e avuto #ristori agevolazioni relative a spese del debito pubblico senza impegno personale x la collettività vaccinandosi?
Perché?";neutro;;;
1423687058078449664;"I ragazzini non vaccinati non potranno, da oggi, entrare in palestra o in piscina con gli amici. Questo è il green pass.
 Un atto di pura malvagità concepito da menti perverse. Un ricatto vigliacco.";contro;;;
1423687142870507523;"06 56557436 
 Pronto soccorso legale gratuito anti green pass
 Tutta Italia
 Tutte le ore.";neutro;;;
1423687163238047745;Mia madre incazzata con la dottoressa perché non le ha voluto fare un permesso per fare palestra senza bisogno del green pass, urlo;neutro;;;
1423687467404828673;Vorrei tranquillizzare i #novax perché neicampi di concentramento (che immaginano dopo il 3° grappino) non li farebbero comunque entrare visto che non hanno il #GreenpassObbligatorio 🤣;pro;;;
1423687635571253267;"Da oggi finalmente #GreenpassObbligatorio e già sento i vari #novax su Twitter lamentarsi. 
Mi fate volare";pro;;;
1423687801388900354;"Armando Siri: ""Col Green Pass vogliono buttare la Lega fuori dal governo""
 Che sarebbe la prima cosa buona che fanno.
 #GreenpassObbligatorio #Lega";neutro;;;
1423688018192437252;"Facciamo un gioco:

Tutti i novax, no green pass, nomask,""è solo un raffreddore"", ""il virus è stagionale"", ecc ecc da una parte

Tutti i provax, sì mask, sì tamponi, sì distanziamento, sì aerazione nei locali, dall'altra.

Dopo 6 mesi ci incontriamo e vediamo ""chi ha vinto""";neutro;;;
1423688091009753093;"che ridere quelli che ""io non entro se mi chiedete il green pass!!!!!!!!!"" come se fosse una loro scelta non entrare campioni di rigiro della frittata";neutro;;;
1423688424834355208;Grazie green pass per le palestre vuote;neutro;;;
1423688782973480965;"Che carini i #novax ed i #NoGreenPassObbligatorio che vanno a cercare in giro per il mondo notizie con il lanternino su vaccinati contagiati...
Staranno tifando per un altro autunno in #lockdown ?";neutro;;;
1423688823633031171;"Se non chiedi il green pass io non entro.
 Non entro perché il tuo locale è a rischio focolaio e mi esponi all’eventualità di finire in quarantena perché qualche cazzone di tuo cliente si è preso il covid e ha contagiato i commensali che sono finiti in terapia intensiva 🤗";pro;;;
1423688962321829889;"Gli onorevoli vanno in vacanza 1 mese
 Con tutto quello che si portano a casa non sarà un problema:
 Il problema è che siamo nella merda e questi vanno pure 1 mese in vacanza!
 Green pass o meno
 (Compresi quelli che dovevano aprire il parlamento come una scatoletta di tonno)
 Stronzi";neutro;;;
1423688997449109511;"Sul foglio per il green pass c'era scritto ""potreste riceverlo tramite app Immuni"" 😂😂😂 c'è ancora chi la usa?? ✈️✈️✈️ Manco il servizio sanitario veneto l'ha usata per tracciare i contagi ✈️✈️✈️";neutro;;;
1423689026238918657;Getting ready to go out io e il mio bestie il green pass vediamo se qualcuno lo chiede o 🤡;neutro;;;
1423689277154729984;Cosa deve/può fare chi ha ricevuto la seconda dose di vaccino ma non ha ricevuto il green pass e non ha nessun tipo di attestato della vaccinazione effettuata? Ogni suggerimento è ben accetto, cordiali saluti Josef K;neutro;;;
1423689456893190153;"In questo particolare periodo storico senza tessera sanitaria non sei nessuno.
 

 Giusto ieri ho perso la mia e quelle dei figli. 
 

 L'adolescente l'hanno comunque vaccinata...
 

 MA COME CAVOLO FACCIO A SCARICARMI IL GREEN PASS??!
 

 #greepass";neutro;;;
1423689715270684672;Pronta a vedere quanta gente stasera tenterà di entrare al ristorante senza Green pass perché so che arriveranno;neutro;;;
1423689874406793217;avete stampato la greenpasse o fate come I NoVax che fanno il tampone anche per andare al bagno?;neutro;;;
1423689953456885764;Green pass: Salvini “per noi importante non rovinare le ferie”. Vuoi mettere un’estate senza Papeete? Puoi pure prenderti il virus, ma il tuo mojito te lo devi fare!;neutro;;;
1423690194880978950;Da pendolare avrei preferito che l'obbligo di green pass fosse stato esteso anche ai treni regionali ed ai bus.;neutro;;;
1423690696247152647;"Ma, precisamente, tutti i miei colleghi no-vax che dicono che dal 1 settembre ""si metteranno in mutua per 9 mesi"", chi hanno come medico di famiglia? Ma soprattutto, almeno quelli di lettere, conoscono la parola deontologia? #cringepass #GreenpassObbligatorio #NoGreenPass #novax";pro;;;
1423690777276858371;È pieno di furbi che si fanno il green pass falso. Che schifo.;neutro;;;
1423691073600331782;ho già sfruttato il mio green pass;neutro;;;
1423691161844256779;Gente che vuole parlare con il capo al telefono quando dico che in caso di voglia stare all’interno c’è bisogno del green pass.;neutro;;;
1423691504753823753;"ho chiamato il villaggio dove abbiamo prenotato le vacanze...
 

 -Buongiorno abbiamo prenotato ma non siamo vaccinati e non abbiamo green pass come funziona? Devo disdire?
 

 -Nessuno ha il green pass?
 

 -No
 

 -Allora non ve lo chiediamo
 

 -Devo fare il tampone?
 

 -No non c'é problema";neutro;;;
1423691566477189120;Qualunque posizione si abbia su #vaccino e Green Pass, effettivamente dovrebbe esserci par condicio tra Italiani e migranti. O se no, continuiamo pure a essere masochisti.;neutro;;;
1423691603395457024;raga qualcuno sa se il green pass per andare al cinema è solo intero o anche prima dose?;neutro;;;
1423691844664320001;stasera vado a mangiare la pizza e posso sfoggiare il mio green pass;neutro;;;
1423691859671625729;"La maggio parte degli italiani il 61% evoca libertà, mentre il 35% significa costrizione. Bella scoperta, avete ""ricattato"" gli italiani, o green pass e quindi ""vaccinazioni"" o in castigo, niente vacanze, divertimenti, ristoranti ecc.ecc. Bravi, gran bel sondaggio.
 .";neutro;;;
1423691869683396619;Ma senza green pass i locali mi fanno fare la pipì per strada?;neutro;;;
1423692049350598657;"Manca ancora un passettino, un passaggino, un saltino di qualità: il Green Pass all'aperto.
 Su, dai, non deludeteci: quand'è che arriva la prossima 'ondata' di terrorismo mediatico per imporre il Green Pass per uscire di casa?";contro;;;
1423692115557691394;Da oggi in palestra serve il green pass. Oggi in palestra non c’è nessuno.;neutro;;;
1423692159971119106;Questa sera dall'amante: tutti quelli con il green pass da una parte, quelli senza dall'altra;neutro;;;
1423692548657266691;Ancora devo capire perché lo chiamano green pass che qui in Olanda è viola e c’è uno in bicicletta.;neutro;;;
1423692597210533895;"Green Pass , mi sono cimentato a scaricarlo.
 Con ""SPID e DGC"" hai il Cartaceo.
 Con ""IO"" lo ottieni per inserirlo sul telefonino,
 E chi legge il QR code ha più informazione di quanto viene fatto sapere al titolare del GREEN PASS.
 l'Uff. complicazione cose semplici ha lavorato bene";neutro;;;
1423692752555020292;non vedo l'ora di avere il green pass;neutro;;;
1423692923640729610;"Ma il ""Green Pass"" per dove?";neutro;;;
1423693049994092552;Ragazzi se avete ricevuto da poco il green pass post prima dose dovete aspettare che il qr code sia valido, consiglio di scaricare l'app VerificaC19 per controllare, finchè non è valido rischiate di rimanere fregati #GreenpassObbligatorio;neutro;;;
1423693089374359553;Green pass. Siamo alla follia dittatoriale. La Costituzione, nei suoi primi articoli è stata calpestata usando gli stivali dei poliziotti.;contro;;;
1423693291015524356;ma perchè il green pass per il cinema all'aperto?;neutro;;;
1423693341066137604;questa mia amica ha ansia a stare da sola a casa e ci ha invitati ad uscire a cena quando né lei né l’altro nostro amico hanno il green pass e non possono mangiare al coperto nei ristoranti e ora si è alzato un vento fortissimo che fuori nemmeno ci puoi stare;neutro;;;
1423693387513929730;"Chiese e alberghi no.
 Parchi museali/divertimento all'aperto sì.
 

 Il green pass dei controsensi.";neutro;;;
1423693424281149441;non ce la faccio, non riesco proprio a trovare un senso ai no vax e no green pass. Escludendo chi è incazzato perché la propria regione è disorganizzata e non ha potuto fare il vaccino.;pro;;;
1423693502953754626;"Si fidano degli iphone ""vinti"" su internet e non si fidano del green pass. 
 Sono strani questi boomer.";neutro;;;
1423693530912919557;Green pass obbligatorio, come si utilizza -;neutro;;;
1423693625473572872;"green pass anche per il cinema all'aperto.
 procediamo completamente alla cazzo.
 ancora niente green pass per entrare in chiesa.";neutro;;;
1423693867296169988;mi hanno chiesto il green pass per la prima volta, finalmente vivo anche io nel 3000.;neutro;;;
1423694071722385413;la soddisfazione nel mostrare il green pass per poter mangiare dentro è unica;neutro;;;
1423695257993203721;Cure domiciliari e no Green Pass ? Qual'e' la ragione di dover rischiare di ammalarsi severamente pur di non vaccinarsi ?;pro;;;
1423695409990541316;Il green pass la cagata del secolo !;contro;;;
1423695618732605443;"Per mangiare alle mense aziendali serve il green pass.
 Ma anche parecchio coraggio.
 #GreenpassObbligatorio 
 #greepass";neutro;;;
1423695649229443078;Oggi pomeriggio sono stata in un centro commerciale… nessun controllo come ovvio … mi fermo a un baretto x un caffè… esposto il cartello che chiedeva il green pass x potersi sedere … all’interno di un centro commerciale… ma veramente fate??;neutro;;;
1423695717936340992;"Ma sai che quasi quasi prenoto un ristorante e sto all'interno, così sono sicuro di non avere vicino qualche coglione #novax  ?
#GreenpassObbligatorio";pro;;;
1423695818536669189;"Green pass = Una ""minaccia"" camuffata per spingere gli indecisi al vaccino ...
 Le provano tutte ed in tanti casi ci riescono.";contro;;;
1423695842897235974;"I vari locali dovrebbero esporre un cartello in cui si precisa: ""il green pass non vale per i parlamentari ma per tutti i locali italiani sì""? Già solo questo dovrebbe far riflettere ...";neutro;;;
1423695908630302725;Con sta storia del Green Pass, faccio pulizia 🧹 🧼 🧽;neutro;;;
1423695925474697221;Sono andata in negozio per plastificare il green pass ma l'autobus è arrivato e mi sono dimenticato del pass adesso sono a casa non sapendo che fare perché non posso manco chiamare perché su google non trovo il negozio :D;neutro;;;
1423695929513807874;oggi al mc mi hanno chiesto il green pass e ho riso ma non so perché, cioè dai ce lo avevo pure ma perché ho riso;neutro;;;
1423696067858739205;Il Green pass per ora è valido solo per 9 mesi, sinceramente spero si organizzino bene perché mi scade quando sono in Erasmus in Francia e se dovrò necessariamente tornare per fare la dose di vaccino giuro che mi incazzo. Possono tranquillamente farmela fare li;neutro;;;
1423696375343104006;L'impressione è che il #greenpass abbia polarizzato ulteriormente gli italiani: i provax che sperano che i novax crepino di covid e i novax che sperano che i provax crepino di reazioni avverse.;neutro;;;
1423696569396834304;"Grazie a quale decreto un ""verificatore"" del Green Pass viene autorizzato a chiedere il documento di identità? Vediamo quanti lo sanno.";neutro;;;
1423696659389853699;In aula la Lega vota a favore del green pass fuori dall'aula è contro.;neutro;;;
1423696781720891393;Ho fatto il green pass. Mi sento impenetrabile;pro;;;
1423696819436101635;Sono entrato in un bar e non mi è stato chiesto il green pass, allora ho chiesto io se potevano controllarmelo, un po’ per il gusto di usarlo finalmente;neutro;;;
1423696858820616193;Quando c’è il lockdown vogliono riaprire ( “ in sicurezza”😂). Quando si riapre non vogliono controllare il green pass che è una misura di sicurezza. Che due enormi maroni. #GreenpassObbligatorio;pro;;;
1423696885240455170;Pensavo non ci fosse nulla di più scemo di un grillino ma poi sono arrivati i #novax.;pro;;;
1423697171568803841;Se devi guidare la macchina devi avere la patente. Se vuoi andare in albergo il green pass. Basta rompere i coglioni;pro;;;
1423697266884464645;mio padre mi vuole buttare dal balcone solo perché secondo lui il green pass si scarica solo dopo la seconda dose🤪;neutro;;;
1423697272194351107;"Ma se non ho il green pass devo prevedere un budget mensile di tamponi di 100 €?
 

 25 € ogni fine settimana?
 

 Se avete altre domande simili apriamo una FAQ";neutro;;;
1423697322937049089;Sono andato al ristorante e mi hanno chiesto il green pass😍😍😍;neutro;;;
1423697377534390282;Questa cosa del green pass mi fa girare le scatole. Non perché non voglio esibirlo ma, semplicemente, ho avuto la sfiga di passare il vaccino tardi e ora mi ritrovo ancora senza.;neutro;;;
1423697413542490115;"Postano sui social anche le foto dei peli pubici, ma il Green pass obbligatorio no, perché ""Un ristoratore non può controllare le mie generalità""
 

  #GreenpassObbligatorio #6agosto #ristorante #vaccinoCovid";pro;;;
1423697450066345984;"#tg4 manda in onda SOLO testimonianze a favore del #GreenpassObbligatorio ! L'apoteosi con la #novax ricoverata pentita( quanto l'avranno pagata?).
LA #Liberta da oggi È MORTA.
Inaccettabile imposizione di una #DittaturaSanitaria";contro;;;
1423697697513648132;ma sto green pass rompe un po eh;contro;;;
1423697871321407493;In palestra mi hanno chiesto il Green pass ✔️;neutro;;;
1423697906683584522;scusate raga, come si fa a scaricare il green pass?;neutro;;;
1423697975851855878;"Da oggi anche al Mcdonald's si potrà mangiare al chiuso solo se muniti di Green-pass. 
 Perché loro ci tengono veramente alla salute delle persone.
 #greepass #GreenpassObbligatorio #6agosto #Mcdonald's";neutro;;;
1423698127375192065;Sono entrato in quattro negozi solo per far vedere il Green Pass;neutro;;;
1423698737327529985;il primo giorno di Green pass è un disastro. Codici che non passano, commercianti che si ribellano, problemi con gli stranieri, soprattutto con inglesi e tedeschi, i quali non hanno il codice e non possono averlo quindi non possono neanche entrare più nei musei.;neutro;;;
1423699139880230912;Ok, il green pass lo hanno letto. Non hanno però controllato il documento.;neutro;;;
1423699547096813568;Giustamente meglio rischiare una nuova chiusura che richiedere il green pass 😅;neutro;;;
1423699665808203780;Qualcuno sta avendo problemi con la ricezione del green pass post seconda dose?;neutro;;;
1423699685546631172;"Una riflessione mentre aspetto lo spritz. Parrucchieri ed estetisti sono stati i primi ad essere chiusi l'anno scorso. Troppo rischio di contagi.
 

 Per loro però non serve green pass. Ormai i buchi di questa misura anti scientifica non si contano più, ma mi sembrava divertente.";neutro;;;
1423699740206764034;"Come insegnante rimango esterrefatta da alcuni commenti su gruppi specifici di colleghi insegnanti contro il green pass obbligatorio per i docenti. 
 Il livello della scuola non si misura dai dati invalsi ma da chi ci lavora .. 
 per fortuna sono una minoranza
 #greenpass
 #scuola";pro;;;
1423700037318676490;raga ma il green pass devo per forza stamparlo o posso semplicemente mostrare il telefono?;neutro;;;
1423700044193181697;"Sarà poi vero che gli ipocondriaci, grazie al Green Pass, ""riprenderanno a vivere"", cioè a uscire, frequentarsi etc?
 Se fosse così, forse accetterei il Green Pass, in nome della solidarietà sociale.
 Ma credo invece che sortirà l'effetto opposto, nutrendo ulteriori paranoie.";neutro;;;
1423700290507784198;ragazzi ma in che senso il green pass non è di colore verde;neutro;;;
1423700421504344066;Ho scaricato il green pass, amore mio come sei bello;neutro;;;
1423700687100207104;Domanda: posso utilizzare il certificato vaccinale sul fascicolo sanitario al posto del green pass? Ancora non mi è arrivato;neutro;;;
1423700759338749955;"Ho appena mostrato il green pass per prendere l'aperitivo.
 Sono orgoglioso del bar scelto!";neutro;;;
1423701043888721926;"Quelli che mettono la coccarda nera lamentandosi del green pass con frasi tipo ""l'Italia è ufficialmente in dittatura"" hanno rotto il cazzo 💕";pro;;;
1423701318762369032;Se il Green Pass, fosse stato imposto da una coalizione di Lega FdI e FI, secondo voi i giornaloni cosa avrebbero scritto, che campagna conte una legge fascista avrebbero scatenato i vari Travaglio Lernrr Gruber Giannini ecc, avrebbero fatto scoppiare la rivoluzione?;neutro;;;
1423701413172072457;Il Green Pass ha prodotto affollamento al banco del bar. Invece sull'autobus state belli pigiati. Negli alberghi non è richiesto. Che stronzata #NoGreenPass.;contro;;;
1423701416728842245;"Test definitivo per capire il disagio mentale del vaccinato: ""i novax mi contagiano"".";contro;;;
1423701573692268545;"Qui Eataly di Pinerolo: controlli severi all’ingresso per il green pass: peccato che le decine di persone all’esterno, per fare pipì, debbano attraversare la sala.
 Siamo o non siamo in Italia!?
 

 🙂🎣🙂";neutro;;;
1423701603849228291;"I novax che, a causa del #greenpass, da oggi boicotteranno i locali mi ricordano quello che si tagliò i genitali per poter fare un dispetto alla moglie.

#GreenpassObbligatorio #6agosto #buonaserata";pro;;;
1423701861597696005;"Da oggi 
 ho bisogno del green pass se: 
 Vado al ristorante,a teatro,in piscina,in palestra,su treni a lunga percorrenza...
 Non ho bisogno del green pass se:
 Festeggio gli europei in piazza,uso mezzi pubblici, partecipo a un rave party,sbarco come finto rifugiato a Lampedusa...";neutro;;;
1423701925300785153;"Vedo molti titolari di green pass correre in fretta al ristorante per mostrare il loro DGC #fallimentare.
 Fate schifo siete delle pecore!";contro;;;
1423701967260487680;Irrigidirsi per chiedere o mostrare il green pass, ma varcato il confine nazionale non fare una piega a mostrare qualsiasi documento anche solo per bere una birra.;neutro;;;
1423702034688139273;Ammettere di non avere il Green Pass diventerà la miglior scusa per rifiutare un invito a cena #GreenpassObbligatorio;neutro;;;
1423702098265444353;siamo al ristorante e non c’hanno chiesto il green pass per entrare funziona proprio ‘sta legge;neutro;;;
1423702108415709195;Nuovo passatempo preferito: segnalare i novax su Facebook;neutro;;;
1423702299822723078;Godendo per la pace dei sensi raggiunta in palestra grazie ai soli presenti entrati col green pass;neutro;;;
1423702664832069639;Ma visto che la nuova tarantella è scuola-green pass è stato detto qualcosa sul fatto che (gran?) parte del personale scolastico fu vaccinato a inizio anno e che il green pass ha validità nove mesi? A ottobre (tra due mesi)? Se lo danno in faccia? Tutto a posto?;neutro;;;
1423702812886769665;"Giornalisti Toscani minacciati di morte dai Novax con messaggi anonimi.
La loro colpa è di aver consigliato e pubblicizzato su giornali,Radio e televisione locali i vaccini.";neutro;;;
1423703124540264457;Stanno facendo multe per il green pass?;neutro;;;
1423703184648855553;Dove vai se il green pass non ce l'hai... 🎶;neutro;;;
1423703387812548614;"Habemus mensoline nuove E green pass da ciclo vaccinale ultimato
 L'universo è in pace";neutro;;;
1423703852948365319;"Quindi ricapitoliamo. Alcuni sono liberi di non vaccinarsi perché nessuno ha imposto l’obbligo vaccinale. Ma se non possono esibire il green pass gli sospendono lo stipendio. 
 

 Solo io trovo che si stia veramente superando la decenza";neutro;;;
1423704137615695874;"Boicottiamo tutti i locali dove esigono il green pass poi vediamo dove va a finire l'economia
 Intanto sia Mirabilandia che Gardaland oggi sono pressoché deserte invece l'anno scorso erano strapiene
 Avanti così adesso tocca anche ai ristoranti e bar
 #NoGreenPass";contro;;;
1423704154833358851;"Avete scelto di essere NoMask, NoVax e NoPass... e mò siate pure NoMagn, NoBall, NoViagg e NoTromb.

#GreenpassObbligatorio";pro;;;
