id;tweet;stance;;;
1423360372942282757;"Niente green pass sui treni pendolari.
 Perché è noto che 500 persone non vaccinate
 compresse per un'ora in una scatola su ruote
 non sono un problema sanitario.
 #covid19italia #greenpass";neutro;;;
1423360546955485184;Il Consiglio dei Ministri ha accolto le richieste del mondo del calcio dando mandato al Dipartimento per lo Sport di dare le linee guida per la presenza effettiva del pubblico al 50% con modalita' a scacchiera e con Green Pass all'interno degli impianti all'aperto. (Ansa);neutro;;;
1423360593147437058;mamma mia da domani non vedo l'ora di sfoggiare il mio cazzo di green pass;pro;;;
1423360595257171973;Silvia lo sai che da domani dovrai controllare i green pass...? #upas;neutro;;;
1423360635199426561;Qualcuno ha per caso visto il cronoprogramma dell'estensione dell'obbligo di green pass? Fra 2/3 settimane nuovo decreto per limitare cosa? Obiettivo total green pass per quando?;neutro;;;
1423360641683894274;"Finalmente decisioni per tempo e chiare per riaprire le scuole in sicurezza: green pass obbligatorio per il personale scolastico, test salivari e tamponi per i bambini e i ragazzi, quasi 2 mld investiti.
 

 Il governo prende sul serio la prima emergenza sociale generata dal covid.";pro;;;
1423360686583857153;Se Jennifer Aniston non è più amica dei novax, io direi che i novax possono fare la stessa fine dei dinosauri;pro;;;
1423360692078485507;"Sapete qual è l'aberrazione del green pass che nessuno riesce a cogliere?
 che lo stato ti considera a priori UN UNTORE E UN MALATO se non ti fai il vaccino e non esibisci il green pass
 cioè tu potresti stare benissimo ma per questi cani di merda lo devi dimostrare,è assurdo";contro;;;
1423360801663037444;Ma il green pass serve per i treni??????? Perché io ho fatto il vaccino ma non mi è arrivato nulla e martedì ho un treno;neutro;;;
1423361113358544903;Dalle anticipazioni il Green Pass all’italiana è ipocrisia assoluta. Servirà e nulla. Trasporti locali no, traporti lunga percorrenza sì. Ma fatemi il piacere;neutro;;;
1423361348784824329;Tutti i grandissimi pezzi di merda che erano favorevoli al Green Pass obbligatorio, adesso saranno soddisfatti della merdata che hanno partorito.;contro;;;
1423361582579453952;I mainstream danno per certo la legge sul green pass,ma ancora si tratta di una bozza...aspettate l'uscita nella G.U...Martacci loro!;contro;;;
1423361667635847171;Come se la suonano e se la cantano. Da titolare di Green pass dico che nessuno si vaccina per la comunità, lo fa per salvaguardare se stesso. Quindi se vuoi vaccinati e usa le precauzioni. Smettiamo di criminalizzare chi la pensa diversamente #inonda;neutro;;;
1423361679954522117;"Green Pass esteso anche ai docenti e studenti universitari.
 Complimenti alla Lega per i suoi incredibili successi. 
 Complimenti a chi li ha votati.
 Complimenti.";contro;;;
1423361684203261960;Hanno fallito coi vaccini ed ora provano col green pass in barba alla Gazzetta ufficiale europea, ma la pagheranno cara da soli: sarete processati nel tribunale della vostra coscienza, non ci scapperete !!!;contro;;;
1423361732450336770;Persino per entrare in ospedale devi avere il green pass, non aspettatevi nulla di buono schifosi;contro;;;
1423361746354458627;Avete votato per il Green Pass, non vi votiamo più.Non avete raggiunto niente.  @maxromeoMB #StaseraItalia;contro;;;
1423361836070678529;"Si può chiedere la carta di identità ad un cliente nel caso acquisti alcol o tabacchi e sembra sia minorenne.
 Perchè mai allora non si potrebbe chiedere il green pass che contiene MENO dati sensibili della C.I. ?
 (chiesta anche a check in o treno) 
 @AugustoMinzolin @InOndaLa7";neutro;;;
1423361906019012617;Da qui al 12 saranno giornate noiose perché non ho ancora il green pass e non posso andare da nessuna parte 🙂;neutro;;;
1423361921408028678;"Domanda. Ma mettiamo che io voglia mangiare al chiuso in un ristorante. Oppure salire su di un pullman. Oltre Al Green pass, il gestore del caso dovrà esigere un documento di identità.
 

 Cioè, diventa pubblico ufficiale? Cosa succede se non ho un documento di identità?";neutro;;;
1423361946372427779;Vorrei un'informazione di servizio: senza il green pass posso andare in un ristorante, ma all'aperto e...ma,ma posso entrare in bagno? 🤔🤔 #staseraitalia;neutro;;;
1423361953163063299;no vabbè da domani per andare ai concerti ci vorrà il green pass e io sono vaccinata con entrambe le dosi da un mese 🥳🥳🥳;pro;;;
1423362052391899136;#Sanremo2022 sarà condotto da Amadeu dall'1 al 5 febbraio. Chi ha il Green Pass vedrà il Festival su Rai1. Chi non ha completato l'iter vaccinale avrà accesso ad altri programmi rai: repliche di fiction, Derrick, maratona di Rosamunde Pilcher ecc.;neutro;;;
1423362065293615107;Draghi alza la voce e ne ha tutto il diritto di farlo Giorgia Meloni butta sul tavo del governo un'idea sul Green pass in primo momento tutti contro e poi Draghi a dato ragione;neutro;;;
1423362084142780421;Una domanda al Presidente Draghi: da domani che scatta l'obbligo del green pass con i migranti che sbarcano che misure adotterà? Saranno obbligati al green pass o loro sono liberi? @Viminale @Palazzo_Chigi @matteosalvinimi @GiorgiaMeloni;neutro;;;
1423362111858782208;#staseraitalia dopo aver ascoltato gli interventi dei partecipanti sul green pass mi si affacciano tre ipotesi, a cominciare da #Lopalco: sono in malafede, sono idioti o sono agenti di #bigfarma! A voi la valutazione e la scelta....;neutro;;;
1423362407506841603;gravissimo obbligo di green pass per tutto il personale scolastico. gravissimo dopo un anno e mezzo in cui non si è fatto assolutamente nulla per adeguare le strutture scolastiche e tutelare il personale con test covid periodici gratis;neutro;;;
1423362509868781571;"Ma in Italia ancora stiamo a sentire quell'afasico di #Locatelli che sbraita sui green pass e sulla #varianteDelta? SVEGLIAAAAA, #didonno martire, dovrebbe essere sepolto a #Gerusalemme! 
 SANTO SUBITO!
 #inonda #cringepass #la7 #GreenpassObbligatorio #vaccini";neutro;;;
1423362703666655232;"Comunque domani è il grande giorno, potrò sfoggiare il green pass davanti agli sguardi spenti dei no vax e ritardatari
 Sarò abbastanza ingestibile e spaccone, ma d’altronde questa non è una novità";pro;;;
1423362750454116354;Allora la Bonafè ci garantisce che con il green pass non ci saranno chiusure. Ricordiamocelo #staseraitalia;neutro;;;
1423362784088272900;Torno dall’estero dove, per farmi ripartire ,GIUSTAMENTE,mi chiedono: certificato di avvenuta vaccinazione, green pass, tampone del giorno prima, mi misurano la febbre. Arrivo a Roma: NULLA. A voi il commento, io non ne ho.;neutro;;;
1423363166839484416;Il Green Pass e' giusto ma incompleto perche' il Governo non ha le capacita' di aver il controllo come dovrebbe essere nelle metro e sugli autobus ove l'assembramento ed i contagi sono piu' a rischio che nei ristoranti.;neutro;;;
1423363200175775745;Covid: Giovannini, 'green pass trasporti da 1 settembre, ancora 618 mln per Tpl'...;neutro;;;
1423363215078170629;Green pass scuola, docenti: stop stipendio dopo 5 giorni di assenza...;neutro;;;
1423363268811370506;Adesso. Io sono vaccinata e ho il green pass. Ma mi sta sulle palle che siamo la sola categoria con l'obbligo. Quindi io la prossima volta che mi vaccino non firmo il consenso.;neutro;;;
1423363350277279756;"Emarginazione sociale dei disadattati #novax molto vicina. Domani si strappa quello buono.
#cringepass";pro;;;
1423363387304644609;"In Austria il  #GreenPass lo chiedono ovunque da mesi e nessuno rompe il cazzo come qua in Italia.
(Sì lo so, i tamponi in Austria sono sempre gratis ma non è questo il problema dei #novax)";pro;;;
1423363481429024772;"si torna al cinema dal novembre 2019.che dire ? nessuno con su la mascherina, zero distanziamento e tutti, ma tutti gruppi famigliari a sto punto.
 le regole?ve le picchiate su nel culo.
 a voi,a noi non serve un green pass:serve un po' di educazione,e tanto buon senso, cazzo.#cine";neutro;;;
1423363737336127492;Comunque il green pass lo hanno organizzato col culo;neutro;;;
1423363770580099086;Draghi: Evvvaiiii con il green pass e con la terza dose prima della fine dell'estate;neutro;;;
1423364031579099141;"La Bonafede (Pd) a @StaseraItalia dice tutto è il contrario di tutto🤮😂.. difende il green pass perché i contagi e il pericolo sta aumentando.. quindi conferma, di fatto, che i vaccini non funzionano!
 Delle due una!";neutro;;;
1423364040437420034;Sono uno su milioni di vaccinati, ma esibire il green-pass mi rende fiero.;pro;;;
1423364377198178310;"Green Pass: attendo di leggere le norme per formarmi una idea al proposito. Allo stato attuale appare un'idea senza molta ragione. Un po' come qualcuno che si definisce scienziato e poi dice che ""potrebbe essere"" o ""dipendere"". La scienza, quella vera, non conosce il ""potrebbe"".";neutro;;;
1423364435545051141;🚨UFFICIALE - Il Consiglio dei Ministri ha accolto le richieste del mondo del calcio dando mandato al Dipartimento per lo Sport di dare le linee guida per la presenza effettiva del pubblico al 50% con modalità a scacchiera e con Green Pass all'interno degli impianti all'aperto.;neutro;;;
1423364473650356224;"Quanto sarei contenta se nonostante il green pass ,la curva dei contagi non si arresti. E non lo dico per cattiveria verso gli Italiani,ma verso questo governo di dittatori. Solo per far fallire questo inutile ""strumento "" #greepass #NoGreenPass #vergogna";contro;;;
1423364515886948357;"La Corte Costituzionale francese ha dato il suo sì al Green Pass. 
 A questo punto allora vogliono proprio indurci a disprezzare le costituzioni, così potranno eliminarle senza rimpianti, per spianare la strada alla nuova normalità globale.";contro;;;
1423364572094869507;mercoledì prossimo seconda dose di astrazeneca e green pass poi mi mancano solo i soldi e potrò andare al ristorante evviva;neutro;;;
1423364666991038466;green pass o no domani il sole sorgerá lo stesso.;neutro;;;
1423364993735696386;"io e i miei amici volevamo andare a roma a settemb ma dal 01/09 per treni itra regioni serve il green pass e tra noi ci sono 2 ""no vax"" (??) quindi noi vaccinati abbiamo iniziato a scherzare sul fatto che faremo tutte le cose senza di loro ed ora se la sono presa mado cazzi vostr";neutro;;;
1423365011649536006;"hanno messo il green pass obbligatorio per il personale scolastico 
 GODO PER I MIEI CAZZO DI PROFESSORI NO VAX";pro;;;
1423365155510005763;Una cosa ho da dire sul green pass non era questo il momento di metterlo. Non è giusto che per 16 fottutissime ore non posso andare in un locale perché non ho il vaccino quando 16 ore dopo ho l'appuntamento per farlo. Non lo trovo giusto, mi viene il nervoso perché non esco +;neutro;;;
1423365174954758148;"#staseraitalia Lo Palco,ass.regione Puglia: ""il green pass è meglio dell'obbligo vaccinale perché ti impedisce di andare al cinema,al teatro,al ristorante!""Guarda che si vive anche senza cinema,teatro e ristorante!!!";contro;;;
1423365274552741888;Obbligo di green pass per docenti, studenti maggiorenni e blocco dello stipendio. L’ennesima vittoria di Salvini insomma;neutro;;;
1423365369117478916;È possibile sapere (dove, come) quanti ragazzi e quante ragazze tra i 12 e i 19 anni non hanno ancora fatto la prima dose di qualsiasi vaccino di provata efficacia? Astenersi #NoVax, #Negazionisti #amichediCrosetto e tifosi del #MessiaDraghi. Grazie.;neutro;;;
1423365408992661508;Ma, con il green pass, è tornato a Palazzo Chigi, Giuseppi Conte?;neutro;;;
1423365618498162695;"Galimberti hai fatto la sintesi della conferenza : ""rendiamoci conto che non è il governo ma è la malattia, c'è la pandemia""; 
 Esattamente, non c'è lo scordiamo, l'importante essere vaccinati, avere green pass e stare attenti 
 

 #inonda";pro;;;
1423365724379271169;Strada dritta…obbligo vaccinale. Strada contorta, Green pass con mille eccezioni. Quale hanno scelto? 🙄;neutro;;;
1423365791114829838;"Il filosofo #Galimberti è goduto al pensiero della punizione a cui saranno sottoposti gli insegnanti #novax ...sospensione e/o licenziamento...

Perchè invece non mandiamo su un'isola deserta tutte le figure inutili come i filosofi #provax ?a zero stipendio";contro;;;
1423365938561392647;"#Nogreenpass per minorenni e studenti!! No green pass per i concorsi! Tutto questo puzza di corruzione lontano un miglio! 
 Non ci avrete! Farete i conti con la Costituzione, siete solo eversori in uno Stato di diritto. La storia emette le condanne più dure e pagherete.";contro;;;
1423365959813849089;"Sorpresa Leuropea. Con il lasciapassare verde militare (cd Green-Pass) assistiamo per convenienza di regime/sorveglianza a 30 anni di retorica europea buttata nel wc. Draghi con l’avallo dei partiti viola anche Regolamenti, TUE e TFUE in un solo colpo.
 Ributtanti tutti
 #greepass";contro;;;
1423365999353647112;Domani scatta obbligo di green pass. Sono in hotel fino a domenica, me lo chiederanno? Che prevede la normativa? @magicadespell78;neutro;;;
1423366164802064394;Green pass una vera schifezza fatta dal Governo... Non risolverete niente a ottobre chiudere te tutto e avrete fatto una figura di merda;contro;;;
1423366179708624897;"Situazione:
 

 Tg2 Post: Cybersicurezza
 Stasera Italia: Green Pass con Giorgia Meloni
 La7: Green Pass con Rula Jebreal
 Repubblica: Green Pass
 Corriere: Green Pass
 Domani: Cybersicurezza
 Il Foglio: Green Pass
 Il Sole 24 Ore: Green Pass
 Huffington Post: Green Pass
 etc.
 

 #noia";neutro;;;
1423366179725447175;SOROS con BILL GATES hanno dato il via ad un nuovo BUSINESS. TAMPONI TAMPONI TAMPONI per tutti coloro che non vogliono vaccinarsi e debbono viaggiare od andare in posti chiusi.COSA VI FA PENSARE ? Fai ciò che vuoi e paga. Quale Green pass...PAGA TASI E PASS;contro;;;
1423366438056759300;stanno per concludersi i lavori di aula, ma subito dopo il ministro Brunetta riferirà in commissione affari sociali sul green pass, darò qualche aggiornamento qui su twitter;neutro;;;
1423366456499187715;Ho prenotato per domani sera in un ristorante che non aveva più posto all’aperto e mi ha chiesto se avessi il green pass. Vi farò sapere.;neutro;;;
1423366630155894787;"Da un lato le reazioni inqualificabili di alcuni insegnanti alla notizia, peraltro ovvia, del green pass obbligatorio per i dipendenti del comparto; dall'altro proposte sconcertanti, come quella del confino per gli insegnanti dissidenti. Che settore disgraziato.";neutro;;;
1423366845252448258;Green pass. Il 3 e 4 ottobre si voterà in 1.162 Comuni italiani, per esempio: Roma, Milano, Torino, Napoli, Bologna ecc. Ricordatevi di non votare i partiti che hanno permesso questa dittatura!;contro;;;
1423366957127045122;Domani esco e do una testa nei denti a tutti i #NoVax che trovo per strada e se mi chiedono qualcosa dico che è stato il microchip che mi hanno iniettato con il vaccino a darmi questi ordini;pro;;;
1423366968128720896;dov’è il mio green pass e che c4zzo 🥲🥲;neutro;;;
1423366976966103040;Ancora oggi c'è gente che va in giro con la museruola in macchina da soli e all'aperto, questi non solo si fanno il green pass ma si faranno mettere pure il guinzaglio;contro;;;
1423366984658468867;La @LegaSalvini sta puntando TUTTO su #complottisti, #terrapiattisti, #novax e #NoGreenPass. Se sei leghista, te ne vanti.;neutro;;;
1423367007068622848;Se accettate come regola il green pass per potervi muovere,state accettando la terza/quarta/quinta dose. Non smetteranno di sperimentare,statene certi. Vi piegheranno con la scusa del maledetto green pass. SE ACCETTATE ADESSO SIETE GIÁ SCHIAVI, faranno con voi cosa caxxo vorranno;contro;;;
1423367129760518152;"Sento un amico ufficiale di polizia .
 Mi dice che nessun esercente può chiedere di vedere il green pass e se le foo se entrano non possono chiedere il green pass ai presenti ma solo chiedere all'esercente se lo ha chiesto ai clienti.
 Mah";neutro;;;
1423367528252837890;gente sul gruppo dell’uni seccata dal fatto che probabilmente per fare le lezioni ci sarà l’obbligo del green pass godo merde;pro;;;
1423367563698921472;lol con il green pass la carriera alias diventa inutile in pratica;neutro;;;
1423367704153673728;"Va riconosciuta a @borghi_claudio una intelligenza superiore...ma non basta: ora diventi il leader del movimento per la libertà: no Green pass, no obblighi vaccinali, no mascherine, basta emergenza, disobbedienza totale, basta LEGA
 

 #nogreenpass #noeuro #liberta #italia #";contro;;;
1423367736802095104;Quando si dice la coerenza: tu entri solo con il green pass ed io che ti servo posso anche non averlo. Qualcuno che mi spieghi la ratio del provvedimento?;neutro;;;
1423368114557816839;"Spiace ma sul green pass, come su tutte le altre misure fondate sulla presunzione di contagiosità (lockdown, coprifuoco, ecc.), la questione è e può essere solo di principio. Scendere sulle tecnicalità è un approccio fallace, i ""difetti"" verranno ovviamente corretti nel tempo.";neutro;;;
1423368127543496708;Ma non avete le palle piene? Dei vaccini .dei vaccinati ,del Green Pass ,dei giornalisti ,dei conduttori televisivi ,dei virologi ,dei politici ,degli immigrati.;neutro;;;
1423368220766052358;Mi permetto da studente universitario di dissentire circa le posizioni prese dal “governo dei migliori” sul green pass, in quanto il diritto alla cultura e all’istruzione non può essere reso ACCESSIBILE soltanto a chi si è sottoposto al trattamento vaccinale. Intanto #NoGreenPass;contro;;;
1423368395895025785;"Riepilogone. Oltre all’obbligo per gli universitari, anche il personale scolastico e universitario dovrà presentare il green pass. In caso contrario, verrà considerata “assenza ingiustificata e dal quinto giorno il rapporto di lavoro è sospeso, niente retribuzione"" #COVID19 👇";neutro;;;
1423368602787397634;Non ho capito i sindacati: niente green pass in ufficio e in fabbrica, ok al green pass per i prof? Ho capito bene?;neutro;;;
1423368620466311171;Il governo rendendo l’obbligo del green pass rende obbligatorio vaccinarsi questo è un abuso verso la libertà di scelta, gli italiani dormono? Non fate nulla nessun politico che abbia tirato fuori i coglioni per mettersi contro Draghi Io non richiederò il green pass per principio;contro;;;
1423368710220353537;"Noi normali al ristorante, al cinema, al teatro, in viaggio...
Voi novax con una gigantesca trave nel culo.

#cringepass";pro;;;
1423368938105327619;Chi controlla se chi entra in una scuola ha il green pass?????;neutro;;;
1423369096880590852;Mi rendo disponibile a dare una mano a chiunque abbia problemi a scaricare o reperire il proprio GREEN PASS. Chi ha problemi mi scriva in privato! #cringepass #greenpass;neutro;;;
1423369423314898947;"Tutti mi domandano cosa ne pensi di tale pandemia e del vaccino per poi arrivare al green pass?
 La mia risposta e non mi interessa nulla so solo che arriverà una seria guerra che qualsiasi forza speciale perderà,arriveranno ad occupare pure i ministeri,la gente se stancata.";neutro;;;
1423369509252042756;Comunque raga ho scoperto che il green pass lo puoi fare pure se nno hai ancora fatto la seconda dose, io l'ho già fatto infatti;neutro;;;
1423369564948152320;Attenzione alla cattiva informazione: Forza Nuova ha deciso di espellere NON chi si vaccinerà ma chi deciderà di usare il green pass. Lo dico nel caso (sono seria) qualcuno volesse vaccinarsi e cambiasse idea per questa cosa. Penso che nonostante, insomma, Forza Nuova sia (1/2);neutro;;;
1423370649242906626;"Il ns governo é uno stronzo di merda io vorrei sapere la gente licenziata x colpa di questo green pass va a mangiare a casa di Draghi e dei parlamentari? 
 Il 1art della costituzione è stato messo sotto i piedi dal dittatore che ci comanda.";contro;;;
1423370724669018122;Oggi comunque sulla app IO mi è arrivato il Green Pass. Ora mi manca solo il Game Pass dal Brasile per risparmiare e coi pass per quest'anno dovrei essere a posto.;neutro;;;
1423370760110972934;Il green pass serve solo per sapere con esattezza quanti imbecilli ci sono in italia?;contro;;;
1423371299309641739;SALVINI LA LEGA PERDE CONSENSO IL GREEN PASS È UNA PORCATA DETTATA DA IN IGNORANTE COMUNISTA ! DI FATTO LA LEGA LO APPOGGIA PERCHÉ?.... FAI SALTARE IL TAVOLO ALTRIMENTI LA. LEGA È COMPLICE E NE PAGHERÀ LE CONSEGUENZE ON TERMINI DI COMSENSO;contro;;;
1423371426522873859;Sono proprio curioso di vedere quanti di quelli che mi chiederanno il green pass si preoccuperanno anche di verificare la mia identità;neutro;;;
1423371510375489536;Con il green pass, Draghi sta dimostrando di essere come tutti i grillini che cedono ai ricatti pur di tenersi la poltrona. Cedere a Speranza e non assumersi le responsabilità delle decisioni significa essere come Conte se non peggio.;neutro;;;
1423371597424078849;Beh, a sto punto apriamo la competizione, se i #novax boicottano i ristoranti che chiedono il #greenpass e i #provax i ristoranti dissidenti, quali dei due tipi di ristoranti falliranno prima?;neutro;;;
1423371622380150790;Maa green pass obbligatorio per università siamo sicur che tutt l student siano riuscit a vaccinarsi per settembre?;neutro;;;
1423371633444667392;Quindi entro al ristorante col Green Pass e vengo accolto da personale per il quale il Green Pass non è obbligatorio. Vaccinato quindi? Boh? Tutto bene;neutro;;;
1423371877997756419;mi viene da piangere vedendo tutte le persone che vanno a vedere the movie e io non ho il green pass perciò non posso;neutro;;;
1423372290490785795;"GREENPASS. Per protesta, centinaia di NoVax telefonano per non prenotare in ristoranti in cui non hanno intenzione di andare, ma segnalano pubblicamente i ristoranti che disertano le norme d'emergenza a vantaggio delle FFOO. 

Panico di ilarità in tutta Italia.";neutro;;;
1423372343825608704;Green pass sui treni con le tariffe più elevate e usati da chi frequenta o abita nei centri urbani più grandi. Contagio libero sui treni di pendolari, studenti, abitanti delle aree più provinciali del Paese e poveracci in genere.;neutro;;;
1423372500436766734;il green pass ficcatevelo nel culo;contro;;;
1423372551707926537;prosegue il Ministro Brunetta: fino al 31 dicembre 2021 tutto il personale scolatico e gli studenti universitari devono avere il green pass;neutro;;;
1423372675611824133;Green pass o non Green pass arriveremo a Roma, malgrado voi. A Roncobilancio incontrammo una ragazza, non era vaccinata e gli abbiamo dato fuoco.;neutro;;;
1423373095369379840;Non ho ancora sentito un #nobrain lamentarsi che serve il Green Pass per visitare un Museo, sarà un caso? #cringepass;pro;;;
1423373138855751682;“Dopo gli ultimi 15 mesi non posso permettermi di assumere una persona che controlli carta di identità e green pass. E sono in tanti come me. Lo farò io”, dice un ristoratore di Treviso che ha posto solo al coperto. Lo ha detto con preoccupazione e stanchezza. Da volergli bene 💖;neutro;;;
1423373167029071877;Quindi un novax lo convinci garantendogli lo stipendio senza lavorare? È come dire di rinunciare al reddito di cittadinanza per lavorare! Sindacati come quelli italiani sono la sciagura dei lavoratori.;neutro;;;
1423373171915464709;Io sono vaccinata ma non userò il green pass. non l'ho richiesto perché mi fa schifo vedere cartelli fuori dai negozi tu non vaccinato non puoi entrare. Ma dai.. non abbiamo imparato niente dalla storia.? #nodio #cringepass;neutro;;;
1423373358293561347;Per chi ha iPhone consiglio il green pass nell’AppleWallet. Doppio clic sul tasto di blocco ed è subito pronto il qr code da far vedere;neutro;;;
1423373639349637124;Domani Green Pass obbligatorio, qualcuno sa se riavrò la possibilità di utilizzare tutti i miei tavoli? Perché sono 18 mesi che lavaoro ad 1/3 della capienza ma al 100% dei costi;neutro;;;
1423373713928491014;Guarda caso i veri liberali che chiedevano a gran voce l’intervento del consiglio costituzionale francese, affinché dichiarasse il green pass anticostituzionale, ora non dicono più nulla🤫;pro;;;
1423373841380823043;il green pass è obbligatorio per gli universitari?;neutro;;;
1423373901657149457;"RaiNews : Insegnanti senza green pass ""sospesi dallo stipendio"".
 

 99,9% degli insegnanti vaccinati in 3...2...1...";neutro;;;
1423374138689921027;#greepass io non ho capito se i dipendenti di un ristorante o bar hanno l’obbligo di avere il green pass ..;neutro;;;
1423374298295767040;"Quelli che all'entrata del locale esporranno a in bella vista fianco del menu la dichiarazione del titolare che attesta che tutto il personale ha il green pass, saranno gli unici bar, ristoranti, pub... frequentabili.
 Diversamente chiuderanno.
 

 E' il mercato, bellezza!
 cit.";neutro;;;
1423374299130437635;Domani sera vado a sfoggiare il mio green pass a una sagra come una provincialotta qualsiasi;pro;;;
1423374327337132046;domani green pass obbligatorio e io non ho ancora fatto/nè farò il vaccino😂🤣🤣🤣🤣🤣🤣🤣;contro;;;
1423374425924280324;"Con il green pass lavoreremo un giorno di meno guadagnando come se avessimo lavorato un giorno di più .
 

 Seriamente, quanto avete ancora intenzione di farvi prendere per il culo";contro;;;
1423374698365300736;GREEN PASS sarà obbligatorio per il treno a lunga percorrenza ma non per sbarcare a Lampedusa .....;contro;;;
1423374752119508997;Ho appena avuto una discussione con mia sorella sull'argomento green pass e poi lei alla fine se ne esce offendendomi e dicendomene di tutte, bha, che ignoranza;neutro;;;
1423375036459757569;posso richiedere il green pass se non ho ricevuto nessuna email e nessun codice?;neutro;;;
1423375101307785218;Green pass. Titolo di un'operetta orgiastica scritta e diretta dalla presidenza del consiglio dei ministri!;contro;;;
